tweetId	authorId	coordinates	date	text	lemmatizedText
1122443603224289280	245330525	null	2019-04-28 12:13:03	Yo ya he ejercido mi derecho y el de los animales. Y vosotros? #VotaPacma #VotaPorLosAnimales @PartidoPACMA https://t.co/KjDhMyV7yQ	#votapacma #votaporlosanimales @partidopacma yo ya haber ejercer mi derecho el de el animal vosotro
1122443617899933698	284224755	[-3.6793, 40.42035]	2019-04-28 12:13:07	El Retiro en Domingo en Parque Retiro https://t.co/aALThnOhpx	el retiro en domingo en parque retiro
1122443618223099904	1387626408	null	2019-04-28 12:13:07	@AlvaroMNF Mi voto siempre será para ti Manfredi	@alvaromnf mi voto siempre ser para tú manfredi
1122443639383384065	4457458037	null	2019-04-28 12:13:12	#sansecastilla de frutos corre que se las pela.menudo repris tiene el dr los navares	#sansecastilla de fruto correr que se él peler menudo repris tener el dr el navar
1122443640352145408	715569216905207808	null	2019-04-28 12:13:12	@davemylight Nada, todo por parar a la ultra derecha. De hecho,creo que quienes luchan por el ultimo diputado en malaga son Psoe y vox	@davemylight nada todo por parar el ultro derecho de hecho creer que quien luchar por el ultimo diputado en malaga ser psoe vox
1122443640704577541	64223584	null	2019-04-28 12:13:12	@manecochayuyo @FELGTB @COGAM @FTriangulo @ChrysallisCan @FerrerChema @MaxJovenGay @Socialista60 @AnabelAlonso_of @jjaviervazquez @javiersanchez La que hizo el Rayo contra LGTBIfóbia en el deporte	@manecochayuyo @felgtb @cogam @ftriangulo @chrysalliscan @ferrerchema @maxjovengay @socialista60 @anabelalonso_of @jjaviervazquez @javiersanchez el que hacer el rayo contra lgtbifóbia en el deporte
1122443645297332224	43319742	null	2019-04-28 12:13:13	No sé qué me da más miedo el que una mujer vote a vox y se quite sus propios derechos o que la mayoría que los votantes sean jóvenes.	no saber qué yo dar más miedo el que uno mujer vote vox se quiter su propio derecho que el mayoría que el votante ser joven
1122443650095566848	532141002	[-3.68333, 40.4]	2019-04-28 12:13:14	Avanzar y no retroceder, hacia delante todo mola mas..🎉🎊 en Madrid, Spain https://t.co/0AebmCpebv	avanzar no retroceder hacia delante todo mola mas 🎉🎊 en madrid spain
1122443656760262657	314730826	null	2019-04-28 12:13:16	@tenhofame A ver si me llega un poco de eso a mí	@tenhofame ver si yo llegar un poco de ese yo
1122443691543625728	1337791717	null	2019-04-28 12:13:24	Mi mayor sorpresa ir a votar y ver a Santi Abascal... en av. San Luís.... #ABASCALPresidente	#abascalpresidente mi mayor sorpresa ir votar ver santi abascal en av ie luís
1122443694093819904	2907650823	null	2019-04-28 12:13:25	Todo bien nada mal	todo bien nada mal
1122443711798042624	1264784004	null	2019-04-28 12:13:29	@CGNavarroPrado Cómo te toca ahí? A nosotros nos corresponde por el Casino y a mis amigos de tu zona (algunos) en Olivar	@cgnavarroprado cómo tú tocar ahí yo yo corresponder por el casino mi amigo de tu zona alguno en olivar
1122443718148145153	8172972	null	2019-04-28 12:13:31	La peatonalización del Paseo del Prado los domingos por la mañana es maravillosa 😍	el peatonalización del paseo del prado el domingo por el mañana ser maravilloso
1122443741963460609	356283950	null	2019-04-28 12:13:36	Cuando quieres decir una cosa y te sale todo lo contrario. 😂😂😂😂	cuando querer decir uno cosa tú salir todo el contrario 😂😂😂😂
1122443787240902656	2700385384	null	2019-04-28 12:13:47	Son  las consecuencias del marxismo socialdemocrata que soportamos.	ser el consecuencia del marxismo socialdemocrata que soportar
1122443792546697216	475667870	[-3.8759, 40.4933]	2019-04-28 12:13:48	😎😎😎 en Las Rozas De Madrid, Madrid, Spain https://t.co/Xnth9dOZJw	😎😎😎 en el roza de madrid madrid spain
1122443797508624384	1439205877	null	2019-04-28 12:13:49	Si mi abuela que casi no puede andar ha ido a votar, no se tú también puedes! #28A #VotaPorFavor https://t.co/730IvFx8uw	#28a #votaporfavor si mi abuela que casi no poder andar haber ir votar no se tú también poder
1122443805247049728	260905241	null	2019-04-28 12:13:51	Lo grave no está el problema del partido de VOX (que si) el problema es que de la noche a la mañana haya recibido tanto apoyo y haya miles de personas que estén a favor de esas ideologías y el partido esté en auge.  Eso da miedo.	el grave no estar el problema del partido de vox que si el problema ser que de el noche el mañana haber recibir tanto apoyo haber miles de persona que estar favor de ese ideología el partido estar en auge ese dar miedo
1122443814008963072	457591889	null	2019-04-28 12:13:53	@Rojiblanco_ATM Omitir un partido o partidos de izquierdas en tu argumento inicial, indica lo que has querido decir, ni más, ni menos.	@rojiblanco_atm omitir uno partido partido de izquierda en tu argumento inicial indicar el que haber querer decir ni más ni menos
1122443838960939008	306233352	null	2019-04-28 12:13:59	Que fácil es echarle la culpa a la gente de algo.	que fácil ser echarle el culpa el gente de algo
1122443955612921856	919590978	null	2019-04-28 12:14:27	Hoy he tenido dos sueños súper bonitos. Me he despertado de súper buen humor😭😍	hoy haber tener dos sueño súper bonito yo haber despertar de súper buen humor😭😍
1122444003734167552	362506229	null	2019-04-28 12:14:39	@Agust_G Que pasa!!!	@agust_g que pasar
1122444022323318785	1428816325	null	2019-04-28 12:14:43	menudo subnormal	menudo subnormal
1122444035724140544	1066749815378386951	null	2019-04-28 12:14:46	@srtacanadas @Opo20172 @OGCSH Jaja jajaja te pasa como a mí, o lo pongo de mi puño y letra y confirmo o no me vale jaja.	@srtacanadas @opo20172 @ogcsh jaja jajaja tú pasar como yo él poner de mi puño letra confirmo no yo valer jaja
1122444072243929089	366633608	null	2019-04-28 12:14:55	Gol de dani gomez. Vamos RmCastilla no nos relajamos apretamos mas nada de empanadas defensivamente serios atras presion muy alta compromiso competitivo concentrados sin cometer errores exando mas cojones k ellos morir en el campo movilidad rápida tener pegada suerte y ganarlos	gol de dani gomez ir rm no yo relajar apretar mas nada de empanada defensivamente serio atro presion mucho alto compromiso competitivo concentrado sin cometer error exar mas cojón él morir en el campo movilidad rápido tener pegado suerte g
1122444076173991937	1252906278	null	2019-04-28 12:14:56	@Tomasnavarropsi Pues empiezan bien los festejos. Felicidades y q no decaiga. Q te hagan muchos regalos	@tomasnavarropsi pues empezar bien el festejo felicidad no decaigar tú hacer mucho regalo
1122444093123190784	17181795	[-3.70161736, 40.42039156]	2019-04-28 12:15:00	I'm at Espacio Fundación Telefónica - @espacioftef in Madrid https://t.co/YwbEsGzXjE https://t.co/Tmifv9J6ID	@espacioftef at espacio fundación telefónico in madrid
1122444097480994817	271871031	null	2019-04-28 12:15:01	@julianigle11 @AD_MAPOMA @RNRmadmaraton @adidas_ES @adidasrunning Ya somos 2 😅	@julianigle11 @ad_mapoma @rnrmadmaraton @adidas_es @adidasrunning ya ser
1122444126027505666	1106951269	null	2019-04-28 12:15:08	Ya solo falta que vuelva a las multis y seré feliz 💜	ya solo falta que volver el multis ser feliz
1122444162018705409	206247408	null	2019-04-28 12:15:16	@engleslixxz Yo también mi bb	@engleslixxz yo también mi bb
1122444183371960320	457591889	null	2019-04-28 12:15:21	@Rojiblanco_ATM Otros hicieron el pacto del tinell, ese estaba bien, eeeeh..!!!😉😉	@rojiblanco_atm otro hacer el pacto del tinell ese estar bien eeeeh 😉😉
1122444195636051968	2778277881	null	2019-04-28 12:15:24	utilizan la bandera lgtbi y el símbolo de la mujer como algo contra lo q luchar pero estamos locos????? de verdad que miedo	utilizar el bandera lgtbir el símbolo de el mujer como algo contra el luchar pero estar loco de verdad que miedo
1122444216074952704	4850474879	null	2019-04-28 12:15:29	@alonso_dm @Sebi_Berenger Ratas Podemitas ni PC.	@alonso_dm @sebi_berenger rata podemito ni pc
1122444216766853120	258766365	[-3.69637, 40.34857]	2019-04-28 12:15:29	¡Qué bien nos la pasamos en ggamefestival! 🎮✨ Siempre es un placer participar en espacios que fortalecen la comunidad de #indiegamedevs, probar juegos nuevos y hacer nuevos amigos 🤗💜… https://t.co/gKmKFTqqNr	#indiegamedevs qué bien yo él pasar en ggamefestival 🎮✨ siempre ser uno placer participar en espacio que fortalecer el comunidad de probar juego nuevo hacer nuevo amigo 🤗💜
1122444224232861696	271871031	null	2019-04-28 12:15:31	@navarro_74 @AD_MAPOMA @RNRmadmaraton @adidas_ES @adidasrunning Seguro que coincidimos en alguna 😉	@navarro_74 @ad_mapoma @rnrmadmaraton @adidas_es @adidasrunning seguro que coincidir en alguno
1122444235335249920	15049736	null	2019-04-28 12:15:34	@linkchetao @NChomsky10 @gabrielrufian ¿A que te refieres con todos? Indra no hace el recuento, lo hacen las mesas electorales. Documéntate, que no te engañen.	@linkchetao @nchomsky10 @gabrielrufian que tú referr con todo indra no hacer el recuento él hacer el mesa electoral documéntate que no tú engañar
1122444241723019266	110438109	[-3.70177, 40.40592]	2019-04-28 12:15:35	Hoy es uno de esos días en los que, aunque no lo parezca, toca hacer algo importante. Para valorar el mundo que se nos puede venir encima, aquí os dejo unos libros urgentes y necesarios… https://t.co/7ysXKYq3Lu	hoy ser uno de ese día en el que aunque no él parecer tocar hacer algo importante para valorar el mundo que se yo poder venir encima aquí tú dejar uno libro urgente necesario
1122444265202880512	102408587	null	2019-04-28 12:15:41	Se confirma que NO se retransmite la final de la #UCLFutsal porque no hay equipos españoles. Además de una decisión de paletos demuestra el poco respeto (una vez más) que se tiene por nuestro deporte. Gracias por nada @Gol	#uclfutsal @gol se confirmar que no se retransmitir el final de el porque no haber equipo español además de uno decisión de paleto demostrar el poco respeto uno vez más que se tener por nuestro deporte gracias por nada
1122444268667273216	306233352	null	2019-04-28 12:15:42	@rmemarta_ Lo siento.	@rmemarta él sentir
1122444277265641473	2913784871	null	2019-04-28 12:15:44	@spacetas Bueno, hay alguna que... 😂	@spacetas buen haber alguno que
1122444282273652736	590943777	null	2019-04-28 12:15:45	Pero qué vergüenza que utilicen el feminismo, la bandera lgtb y las cadenas de televisión como enemigo. Votad con cabeza	pero qué vergüenza que utilizar el feminismo el bandera lgtb el cadena de televisión como enemigo votad con cabeza
1122444281661280257	1481960185	null	2019-04-28 12:15:45	Es tu derecho, hoy #28Abril, vota. https://t.co/mgsWjaRnBw	#28abril ser tu derecho hoy votar
1122444286396641280	1236903908	null	2019-04-28 12:15:46	Eso, tmb pensabas seguir viviendo en Vallecas. Ya veremos a qué colegio van...	ese tmb pensar seguir vivir en valleca ya ver qué colegio ir
1122444291702427650	864089905328250881	null	2019-04-28 12:15:47	@Saulalia Yo ya fui. Tengo pruebas	@saulalia yo ya ser tener prueba
1122444304742518784	262329885	null	2019-04-28 12:15:50	Medio Maratón... 🏃🏼‍♂️😉 #relive https://t.co/KLm34MPC1m	#relive medio maratón 🏃🏼‍♂️😉
1122444312766222337	450853334	null	2019-04-28 12:15:52	Hola, en mi colegio electoral, no he visto hoy a ningún  apoderado ni a ningún ni a ningún  interventor.	hola en mi colegio electoral no haber ver hoy ninguno apoderado ni ninguno ni ninguno interventor
1122444316578918400	975514961723224064	null	2019-04-28 12:15:53	Combatiremos hoy en las urnas y siempre donde haga falta, lo que sea por acabar con vosotros	combatir hoy en el urna siempre donde hacer falta el que ser por acabar con vosotro
1122444316910260224	48015638	null	2019-04-28 12:15:53	@carmenbeat Incluso en la democracia de audiencias, necesitamos rituales de participación.	@carmenbeat incluso en el democracia de audiencia necesitar ritual de participación
1122444316968988673	54240331	null	2019-04-28 12:15:53	@GarroteSSB Prometo en en singles vuelvo por arriba siempre :(	@garrotessb prometo en en singl vuelvo por arriba siempre
1122444348589838338	284279425	null	2019-04-28 12:16:01	Que ganitas de votar!! Todes que puedan a votar que lo hagan por todEs. #VotaPorFavor #28A	#votaporfavor #28a que ganita de votar tod que poder votar que él hacer por tod
1122444367900422144	271871031	null	2019-04-28 12:16:05	@yolandahds No sé qué tiene esta distancia que engancha mucho 🤟🤟🤟  https://t.co/81IWZ6pvl4	@yolandahds no saber qué tener este distancia que enganchar mucho 🤟
1122444383280926720	533329644	null	2019-04-28 12:16:09	@iCity93 Qué grupos tan chulis te enseño eh	@icity93 qué grupo tanto chulis tú enseñar eh
1122444391241568256	401390497	[-3.8647, 40.3218]	2019-04-28 12:16:11	Las más traperas estilosas 💅 en Móstoles, Madrid, Spain https://t.co/tQLNLbWWBv	el más trapero estiloso en móstol madrid spain
1122444430789758976	116865185	null	2019-04-28 12:16:20	@hcruz2107 Tambieeennn :(((	@hcruz2107 tambeeenn
1122444467791958018	817419991591112704	null	2019-04-28 12:16:29	Amor,sabes q mis mayores han vivido allí,y yo también,pero no me importa decir q desde q está Iglesias le he votado aunque,lo sabes tú cómo él lo están haciendo bien,luego nos vemos	amor saber mi mayor haber vivir allí yo también pero no yo importar decir desde estar iglesia él haber votar aunque él saber tú cómo él él estar hacer bien luego yo ver
1122444481226321921	314730826	null	2019-04-28 12:16:32	Sí y no, el problema es que el que salga V0X es que ahora la peña lgtbfoba va a estar más exaltada y se van a ver más respaldados a la hora de darnos de palos.  Lo que no quita que sí, lo peor va a ser todo el tema de la brecha económica que van a crear.	sí no el problema ser que el que salir v0x ser que ahora el peña lgtbfoba ir estar más exaltado se ir ver más respaldado el hora de darno de palo el que no quitar que sí el peor ir ser todo el tema de el brecha económico que ir crear
1122444506937294848	267052438	null	2019-04-28 12:16:39	@ludictador Efectivamente, ahora a seguir currando. Gracias Flavio!	@ludictador efectivamente ahora seguir currar gracia flavio
1122444526298324992	738166677490130944	null	2019-04-28 12:16:43	@fjcovarru Totalmente de acuerdo. De seguro las corrientes fantásticas basadas en mitos, se le van a oponer, pero hay que seguir adelante con esta noble causa.	@fjcovarru totalmente de acuerdo de seguro el corriente fantástico basado en mito él él ir oponer pero haber que seguir adelante con este noble causa
1122444532816187392	1937948460	null	2019-04-28 12:16:45	@soco_rrista Jajajajaja, eso siempre, y con el cuarto de baño al fondo. 😪😂😂	@soco_rrista jajajajajar ese siempre con el cuarto de baño al fondo 😪😂😂
1122444572553031680	720272389892755457	[-3.58246078, 40.46978698]	2019-04-28 12:16:54	Reencuentros que me llenan de ilusión y amor ♥️✨ #TrabajoSocialPorElMundo en Meliá Barajas https://t.co/OGmk21YMKH	#trabajosocialporelmundo reencuentro que yo llenar de ilusión amor ♥️✨ en meliá baraja
1122444591830110209	1099362388032348160	null	2019-04-28 12:16:59	Estás elecciones sí que tiene que quedar claro que los españoles no somos las escoria de los partidos de derechas... Hay que quitar de una vez los restos del franquismo democráticamente	estar elección sí que tener que quedar claro que el español no ser el escoria de el partido de derecha haber que quitar de uno vez el resto del franquismo democráticamente
1122444604039675904	111150638	null	2019-04-28 12:17:02	@Caban0es Esa opción me gusta más! https://t.co/sX9S4BrwCf	@caban0es ese opción yo gustar más
1122444606036160512	817419991591112704	null	2019-04-28 12:17:02	Lo están haciendo mal	él estar hacer mal
1122444653264035840	25095402	null	2019-04-28 12:17:14	Colegio electoral de Madrid, todos los interventores de los partidos políticos responden amablemente a las preguntas de @BluRadioCo, todos menos los representantes de Vox que dicen preferir que hablen sus portavoces #28A #EleccioneGenerales28A	@bluradioco #28a #eleccionegenerales28a colegio electoral de madrid todo el interventor de el partido político responder amablemente el pregunta de todo menos el representante de vox que decir preferir que habler su portavoz
1122444671093882880	1179981192	[-3.7058, 40.4203]	2019-04-28 12:17:18	'Aragorn' acaba de convertirse en TT ocupando la 9ª posición en España. Más en https://t.co/K5DFqqcseW #trndnl https://t.co/zLfN7rS6mP	#trndnl aragorn acabar de convertirse en tt ocupar el 9ª posición en españa más en
1122444672109092864	1531589856	null	2019-04-28 12:17:18	La vida me vacila hermano	el vida yo vacilar hermano
1122444673216282624	1531589856	null	2019-04-28 12:17:18	TRIBADE VIENE A MADRID EL PUTO 25 DE MAYO	tribadir venir madrid el puto 25 de mayo
1122444676840284161	1531589856	null	2019-04-28 12:17:19	Con los putos exámenes que me cago en mi estampa	con el puto examen que yo caer en mi estampa
1122444701456576514	1944552926	null	2019-04-28 12:17:25	Derecho a voto ejercidísimo chaval	derecho voto ejercidísimo chaval
1122444784419966982	174731215	[-3.5551, 40.4232]	2019-04-28 12:17:45	Tras una semana parado a la fuerza por enfermedad vuelvo a la actividad.  En un estado de forma lamentable y con las primeras competiciones encima, pero son… https://t.co/ilgCbHcGTY	tras uno semana parado el fuerza por enfermedad volver el actividad en uno estado de forma lamentable con el primero competición encima pero ser
1122444811804520448	407055124	null	2019-04-28 12:17:51	🥇Enhorabuena @mAiTesL86! Las ganas y determinación con que afrontas los retos es #impresionante. Tu taller fue el primero que se confirmó para #LEED19 y ha sido un éxito rotundo. Ahora a seguir creciendo y aportando tus ideas y recursos para todos. 👩‍🏫 @LiceoEuropeo  @GEGSpain	@maitesl86 #impresionante #leed19 @liceoeuropeo @gegspain 🥇enhorabuen el gana determinación con que afrontar el reto ser tu taller ser el primero que él confirmar para haber ser uno éxito rotundo ahora seguir crecer aportar tu idea recurso para todo 👩‍🏫
1122444840019668994	153001705	null	2019-04-28 12:17:58	@Zaski1 @Waxipola Tristemente es así	@zaski1 @waxipola tristemente ser así
1122444886052093952	1236903908	null	2019-04-28 12:18:09	Yo tmb, a ver si te mandamos a cambiar el colchón a otra casa	yo tmb ver si tú mandar cambiar el colchón otro casa
1122444894675533824	958225890	[-3.63280535, 40.43469478]	2019-04-28 12:18:11	El viernes tocaba Cádiz y el sábado Madrid.  . No puedes cansarte cuando te apasiona lo que haces. Emprendedores del mundo... no estáis solos 💪🏼💥🤘🏼 en Grupo CTO https://t.co/1zcgtQUqQD	el viernes tocar cádiz el sábado madrid no poder c cuando tú apasionar el que hacer emprendedor del mundo no estar solo 💪🏼💥🤘🏼 en grupo cto
1122444901877202945	1102548202362994688	null	2019-04-28 12:18:13	Última jornada de la fase de ascenso a División de Honor. Los equipos apuran la última oportunidad del ascenso. El equipo masculino de Boadilla pugnará por una plaza. ¡Aúpa Boadilla! 🏓🏓 https://t.co/dyL4XABFAy	último jornada de el fase de ascenso división de honor el equipo apurar el último oportunidad del ascenso el equipo masculino de boadilla pugnar por uno plaza aúpo boadilla 🏓🏓
1122444913210208256	189631339	null	2019-04-28 12:18:15	El que diga que cuando tiene pareja no se aleja de la gente es por que no le importa la relación, es inevitable no alejarse.	el que decir que cuando tener pareja no él alejar de el gente ser por que no él importar el relación ser inevitable no a
1122444914724343814	222885728	null	2019-04-28 12:18:16	Menos de 1 mes  No me quiero ir aún 😭😏	menos de mes no yo querer ir aún 😭😏
1122444930994135041	331828543	null	2019-04-28 12:18:20	Pues la peli de Han Solo me ha parecido bastante entretenida, claro que no tenía las expectativas demasiado altas. No me acordaba de que salía Emilia Clarke y me parece maravilloso &lt;3	pues el peli de haber solo yo haber parecer bastante entretenido claro que no tener el expectativa demasiado alto no yo acordar de que salir emilia clarke yo parecer maravilloso lt;3
1122444931711344640	817419991591112704	null	2019-04-28 12:18:20	Pues desde hace tiempo el obrero vota a la derecha,¿Miedo	pues desde hacer tiempo el obrero votar el derecha miedo
1122444938711568384	974022020	[-3.81095862, 40.46696091]	2019-04-28 12:18:22	#RETENCIÓN nivel AMARILLO en AUTOPISTA / AUTOVÍA #A6 (pk 12.5 al 14 decreciente) POZUELO DE ALARCON #DGTMadrid #DGT https://t.co/R5J5fNWx0T	#retención #a6 #dgtmadrid #dgt nivel amarillo en autopista autover pk 12 al 14 decreciente pozuelo de alarcon
1122444939328143360	113499898	null	2019-04-28 12:18:22	@kroketen @obdriftwood Un fuerte abrazo de alguien que vive en Campociudad y fue al San Agustín.	@kroketen @obdriftwood uno fuerte abrazo de alguien que vivir en campociudad ser al san agustín
1122444944105529345	1531122151	null	2019-04-28 12:18:23	Independentistas, acordaros hoy solo se mete la papeleta en la una UNA sola vez	independentista a hoy solo él meter el papeleta en el uno uno solo vez
1122444949272834048	283646294	null	2019-04-28 12:18:24	No sé cómo no había visto este partido nunca. Y nos quejamos de los robos del Barsa ahora 😂   https://t.co/feeAiSkxYk	no saber cómo no haber ver este partido nunca yo quejar de el robo del barsa ahora
1122444974757433350	4850474879	null	2019-04-28 12:18:30	@JuanaTorquemada @Jogonrod75Jose ¿Lo que no soy es una Gilipollas como tu?	@juanatorquemada @jogonrod75jose el que no ser ser uno gilipolla como tu
1122444986023403521	216625209	null	2019-04-28 12:18:33	En plena Libertad y algo de #democracia ya vote ejercici mi derecho, espero que #España esta noche sea más #progresita	#democracia #españa #progresita en pleno libertad algo de ya votar ejercici mi derecho esperar que este noche ser más
1122444988468682752	362506229	null	2019-04-28 12:18:33	Joyita de manga.	joyita de manga
1122444989517135873	460875601	null	2019-04-28 12:18:34	El mio es Oeruy94	el mio ser oeruy94
1122445006621614082	1908584972	null	2019-04-28 12:18:38	No hay palabras para agradecerte por todo lo que nos has dado. Gracias por defender al Atleti tanto como jugador como entrenador. Felicidades 🎂 @Simeone https://t.co/VWty8KtOgK	@simeone no haber palabra para agradecerte por todo el que yo haber dar gracia por defender al atleti tanto como jugador como entrenador felicidad
1122445033691652097	614338688	null	2019-04-28 12:18:44	Mucha gente del 2001 puede votar https://t.co/13eCqvGuUX	mucho gente del 2001 poder votar
1122445044441657345	91220535	null	2019-04-28 12:18:47	@diana_aceves_ Yo también voy ! https://t.co/hu9C8A4QQa	@diana_aceves yo también ir
1122445070161125376	349760012	null	2019-04-28 12:18:53	Nos vamos a quedar 3 en el grupo 😂😂😂😂😂 https://t.co/bSbGmY4ETm	yo ir quedar en el grupo 😂😂😂😂😂
1122445095108788225	143396227	null	2019-04-28 12:18:59	@TwittBoy Todavía hay tiempo pero el caminito y la rachita que llevan no pinta nada bien...	@twittboy todavía haber tiempo pero el caminito el rachita que llevar no pintar nada bien
1122445098845970432	359732701	null	2019-04-28 12:19:00	Odio comenzar el día amargado	odio comenzar el día amargado
1122445105905000448	1884398202	null	2019-04-28 12:19:01	Acabo de cruzarme con un joven alemán, armario de dos cuerpos, guapo. Camisa blanca de lino a punto de estallar, mocasines marrones sin calcetines y pantalón corto de fino algodón color rosa salmón y decorado con peras 🍐 pequeñas.  Pensé que iba en calzoncillos.	acabo de cruzarme con uno joven alemán armario de dos cuerpo guapo camisa blanco de lino punto de estallar mocasin marrón sin calcetín pantalón corto de fino algodón color rosa salmón decorado con pera pequeño pensar que ir en calzoncillo
1122445161823383553	331828543	null	2019-04-28 12:19:15	VAYA, NO ME LO EXPERABA...	ir no yo él experar
1122445170291761153	211089115	null	2019-04-28 12:19:17	@kurro_bg Muy bueno es.	@kurro_bg mucho buen ser
1122445257549983744	193242798	null	2019-04-28 12:19:38	"@NeoDaVe Q significa ""justo"" y justo para quien?? Esas son las preguntas ..."	@neodave significar justo justo para quien ese ser el pregunta
1122445266177679360	189631339	null	2019-04-28 12:19:40	@agusn1903_ Hola bebesito	@agusn1903 holar bebesito
1122445269893812224	284501553	null	2019-04-28 12:19:41	@formulatvfans ¿Has votado a Raoul o Cepeda?	@formulatvfans haber votar raoul cepeda
1122445280253743104	1236903908	null	2019-04-28 12:19:43	Una España en la que tu no estés de presidente, el futuro será mas seguro	uno españa en el que tu no estar de presidente el futuro ser mas seguro
1122445301963534336	2359365302	null	2019-04-28 12:19:48	@agustingc2012 @OvniSpaiN @exploracionovni @jaimemaussan1 Anoche sobre 21:45h vi haz de luz azulado en Barbastro dirección Barcelona. El haz de Luz apareció y desapareció en segundos.	@agustingc2012 @ovnispain @exploracionovni @jaimemaussan1 anoche sobre 21:45h vi haz de luz azulado en barbastro dirección barcelono el haz de luz aparecer desaparecer en segundo
1122445341243129863	24879843	null	2019-04-28 12:19:58	Ya he votado y he sentido muchísima emoción. Ojalá el resultado me emocione igual o más. #VotaConOrgullo	#votaconorgullo ya haber votar haber sentir muchísimo emoción ojalá el resultado yo emocioner igual más
1122445383945400322	711315165	null	2019-04-28 12:20:08	@middock Por insta principalmente si 😂	@middock por instar principalmente si
1122445407597006848	354458995	null	2019-04-28 12:20:13	Quiero ir a correr, pero me da taaanta pereza levantarme	querer ir correr pero yo dar taaanto pereza l
