tweetId	authorId	coordinates	date	text	lemmatizedText
1122588172871925761	612698606	null	2019-04-28 21:47:31	Tengo muy claro que esta música, esta marcha, este himno, ha quedado grabado a fuego en mi mente y mi corazón para siempre. https://t.co/58K3xv8hhR	tener mucho claro que este música este marcha este himno haber quedar grabado fuego en mi mente mi corazón para siempre
1122588177271795713	59436470	null	2019-04-28 21:47:32	"Es que os imagino diciendo esto a todo el que ha votado, como él.   ""Enhorabuena por contribuir al gobierno del PSOE con C's con el puto voto útil.""  https://t.co/OLDkTh9oFY"	ser que tú imaginar decir este todo el que haber votar como él enhorabuenar por contribuir al gobierno del psoe con con el puto voto útil
1122588201896562694	260158634	null	2019-04-28 21:47:38	“División suicida” creo que es el nombre correcto... #28A	#28a “división suicida creer que ser el nombre correcto
1122588237959172096	734414653	null	2019-04-28 21:47:47	Me estoy poniendo enferma x favor, la gente en general es una inconsciente	yo estar poner enferma favor el gente en general ser uno inconsciente
1122588247023071233	353076407	null	2019-04-28 21:47:49	¡Ni un paso atrás! Orgullo de España y de la mayoría de españoles, más maduros, moderados y con más sentido común que lo que muchos políticos piensan 👏🏻👏🏻👏🏻 #EleccionesGenerales28A #EleccionesGenerales #28A https://t.co/Yq0iZtlNf7	#eleccionesgenerales28a #eleccionesgenerales #28a ni uno paso atrás orgullo de españa de el mayoría de español más maduro moderado con más sentido común que el que mucho político pensar 👏🏻👏🏻👏🏻
1122588250047176705	2283970422	null	2019-04-28 21:47:50	@MsNaranjito Cuando puedes?	@msnaranjito cuando poder
1122588272394428419	2907650823	null	2019-04-28 21:47:55	Ciudadanos sigue subiendo joder que inutilidad de pais	ciudadano seguir subir joder que inutilidad de pais
1122588274466467843	58945663	null	2019-04-28 21:47:55	@julenn26 pero quien ha dicho eso? jajajaja Hablo de mi abuela y que vota a Izquierdas. Nadie ha hablado de las demás personas mayores. La gente que sacáis puntilla a todo , de verdad , que aburrimiento	@julenn26 pero quien haber decir ese jajajajarse hablo de mi abuela que votar izquierda nadie haber hablar de el demás persona mayor el gente que sacáis puntillar todo de verdad que aburrimiento
1122588284482408448	2729482587	null	2019-04-28 21:47:58	Hoy me sentía con Flow. https://t.co/s1ClnAEF1D	hoy yo sentir con flow
1122588295022698496	87802215	null	2019-04-28 21:48:00	Galicia forever bipartidista... Non temos remedio https://t.co/wGioGZzkOo	galicia forever bipartidista non temo remedio
1122588311846100993	90277465	null	2019-04-28 21:48:04	Señores el PP pierde solo y por Casado.  Qué candidato de mierda, qué mal estratega, qué poco pensamiento político.	señor el pp perder solo por casado qué candidato de mierda qué mal estrategar qué poco pensamiento político
1122588316707250176	250803419	null	2019-04-28 21:48:06	@Cristian_ORC @MenezRM A ver chaval si es el mismo Menez el que lo está mezclando	@cristian_orc @menezrm ver chaval si ser el mismo menez el que él estar mezclar
1122588329663504385	627603028	null	2019-04-28 21:48:09	Solo queda decir Enhorabuena al PSOE!!! Es lo que España ha decidido.	solo quedar decir enhorabuena al psoe ser el que españa haber decidir
1122588332930818049	418644676	null	2019-04-28 21:48:09	@labreikin Me ha emocionado este twit!! Es que es verdad...	@labreikin yo haber emocionar este twit ser que ser verdad
1122588348198137857	405386224	null	2019-04-28 21:48:13	@eltaxidemadrid Me escuchas?	@eltaxidemadrid yo escuchar
1122588350714712065	40272211	null	2019-04-28 21:48:14	@CarlosEZuniga @DiegoElFantasma Date cuenta que ha puesto lo del pan en el MEDIO PARA QUE TODO EL MUNDO SE DÉ CUENTA que es un cñor. https://t.co/dFM1EW6BFq	@carlosezuniga @diegoelfantasma datar cuenta que haber poner el del pan en el medio para que todo el mundo se dar cuenta que ser uno cñor
1122588361582153729	733384837	null	2019-04-28 21:48:16	@DarioEstraviz Ahora diluidos entre Cs y Vox, pero el porcentaje de votos y numero de diputados de derechas no baja apenas (hasta 167 suman entre los 3 en los sondeos) 🤔	@darioestraviz ahora diluido entre cs vox pero el porcentaje de voto numero de diputado de derecha no bajar apenas hasta 167 sumar entre el en el sondeo
1122588394327027723	102088479	null	2019-04-28 21:48:24	En noches como hoy se ve lo importante para un partido político, su supervivencia. Gobernar es el paso intermedio para mantener una estructura de empleados. El PP, es un partido que lo único que deberia hacer es desaparecer	en noche como hoy se ver el importante para uno partido político su supervivencia gobernar ser el paso intermedio para mantener uno estructura de empleado el pp ser uno partido que el único que deberiar hacer ser desaparecer
1122588399813169153	4020178575	null	2019-04-28 21:48:25	El fachaleco está pasado de moda 😏	el fachaleco estar pasado de moda
1122588406092058629	250803419	null	2019-04-28 21:48:27	@AmayaRMCF Tampoco te había preguntado	@amayarmcf tampoco tú haber preguntar
1122588427004915715	187594920	null	2019-04-28 21:48:32	Tengo recopilados proyecciones fail de todos los gustos, os vais a divertir.	tener recopilado proyección fail de todo el gusto tú vais divertir
1122588454599184386	112793148	null	2019-04-28 21:48:38	Quiero dar las gracias a Cayetana Álvarez de Toledo por terminar de romper el PP en Catalunya	querer dar el gracia cayetano álvarez de toledo por terminar de romper el pp en catalunya
1122588462836801537	518916002	null	2019-04-28 21:48:40	@alfredoduro1 Completamente d acuerdo Alfredo lo d hoy se tiene q oír para q lo no nos quiten mas en estos 3 partidos vamos GETA	@alfredoduro1 completamente acuerdo alfredo el hoy se tener oír para él no yo quiter mas en este partido ir geta
1122588491211321345	405593326	null	2019-04-28 21:48:47	@Andrea_ATM7 Me acabas de decir un piropo PRECIOSO te como esa carita	@andrea_atm7 yo acabar de decir uno piropo precioso tú como ese carita
1122588492599578631	425360393	null	2019-04-28 21:48:47	@aanna_14 Real como la vida misma, si hubiera un tanque de crema en mi casa, me metía entera y no salía 🤦🏻‍♀️🤦🏻‍♀️	@aanna_14 real como el vida mismo si haber uno tanque de crema en mi casa yo meter entero no salir 🤦🏻‍♀️🤦🏻‍♀️
1122588501571248128	246436467	null	2019-04-28 21:48:50	Esta es la sentencia de @jazarzalejos :”VOX es tóxico y está destruyendo a la derecha española”.  #EleccionesL6 #ElecccionesGenerales28A	@jazarzalejos #eleccionesl6 #elecccionesgenerales28a este ser el sentencia de ”vox ser tóxico estar destruir el derecha español
1122588514053390337	87481093	null	2019-04-28 21:48:53	Soraya es TT. Qué país 🤣	soraya ser tt qué país
1122588514615480320	268263737	null	2019-04-28 21:48:53	Huele a nueva crisis económica 😭	holer nuevo crisis económico
1122588521921961985	235668152	null	2019-04-28 21:48:54	@ACMilanGoleador No era penal nuuunca	@acmilangoleador no ser penal nuuunca
1122588527722680324	212627200	null	2019-04-28 21:48:56	@ricohill8 @el_trinkel Miedo por el resultado, y por la euforia en cierta gente	@ricohill8 @el_trinkel miedo por el resultado por el euforia en cierto gente
1122588532009316352	627603028	null	2019-04-28 21:48:57	A Casado se lo cargan hoy, no llega a mañana	casado él él cargar hoy no llegar mañana
1122588536132243457	471309337	null	2019-04-28 21:48:58	¿Dónde están los que decían que VOX iba a ser la primera fuerza de la derecha?	dónde estar el que decir que vox ir ser el primero fuerza de el derecha
1122588542797058048	16978640	null	2019-04-28 21:48:59	Zarzalejos acaba pidiendo el voto calle por calle. Cuando el escrutinio llegue a 90 seguirá diciendo q no nos fiemos #EleccionesL6	#eleccionesl6 zarzalejo acabar pedir el voto calle por calle cuando el escrutinio llegar 90 seguir decir no yo fier
1122588544948690944	229605474	null	2019-04-28 21:49:00	Y yo con esa sensacion de que hemos perdido, de otra manera, pero perdido, otros 4 años de inmovilismo, de postureo.	yo con ese sensacion de que haber perder de otro manera pero perdido otro año de inmovilismo de postureo
1122588556344614913	211318016	null	2019-04-28 21:49:03	Pero como no renuncie...toda la campaña con el cordón sanitario 🤦‍♀️	pero como no renunciar todo el campaña con el cordón sanitario 🤦‍♀️
1122588560408887296	612698606	null	2019-04-28 21:49:04	Me la quedo para siempre. https://t.co/qn4xwcSsJ1	yo él quedar para siempre
1122588567950303234	987619058341343232	null	2019-04-28 21:49:05	@aplako oiga respete	@aplako oigar respete
1122588587676045315	189071654	null	2019-04-28 21:49:10	@ManuAlv_ @Beatrizxy @El_Neyra @sabela11n @jlrios04 @marisamtlg @Alternate747 @Gigaherzio @3S5pepe @carolfanucci1 Intentando que llegue la hora y me abran la puerta de la jaula, tengo las alas entumecidas..   Gracias Manu	@manualv @beatrizxy @el_neyra @sabela11n @jlrios04 @marisamtlg @alternate747 @gigaherzio @3s5pepe @carolfanucci1 intentar que llegar el hora yo abrar el puerta de el jaula tener el ala entumecido gracias manu
1122588600007372800	405593326	null	2019-04-28 21:49:13	no sabía que necesitaba este tweet hasta que lo he visto	no saber que necesitar este tweet hasta que él haber ver
1122588623818428417	2278033702	null	2019-04-28 21:49:19	@Cazatalentos Es un alivio saber que España no es fascista.Un poco de decepción con la bajada de Unidas Podemos que ya se intuía, y muy contenta con el bajón del Partido Popular Y la subida del PSOE. Ahora solo falta que el PSOE pacte con la izquierda y no con CES.	@cazatalentos ser uno alivio saber que españa no ser fascista un poco de decepción con el bajada de unida poder que ya él intuir mucho contento con el bajón del partido popular el subida del psoe ahora solo falta que el psoe pactar con el izquierda no con ce
1122588633477918720	312221954	null	2019-04-28 21:49:21	Vaya mierda de máquinas @easy_vending  No me sale una bien hoy. Me debéis 1€ https://t.co/YpEcfSlpfm	@easy_vending ir mierda de máquina no yo salir uno bien hoy yo debéis 1€
1122588670710755331	496786179	null	2019-04-28 21:49:30	Sigo el escrutinio en A3 para oír las sandeces de Villalobos, tipo: “hay que volver a la España de los 2 partidos, qué es esta locura de tanto partido?” Las izquierdas siempre hemos tenido varías opciones, y no nos acojonamos por tener opciones Querido PP: hueles el miedo? #28A	#28a seguir el escrutinio en a3 para oír el sandez de villalobo tipo “hay que volver el españa de el partido qué ser este locura de tanto partido el izquierda siempre haber tener varías opción no yo acojonar por tener opción querido pp huel el miedo
1122588682328977408	300004075	[-3.70458983, 40.41223356]	2019-04-28 21:49:33	París en Madrid #cadenas #pontdesarts #metro en Tirso de Molina (Madrid Metro) https://t.co/BXPUxnrpwt	#cadenas #pontdesarts #metro parís en madrid en tirso de molina madrid metro
1122588685613109250	40272211	null	2019-04-28 21:49:33	Emanuel Herrera, pucha.	emanuel herrera puchar
1122588703053025280	452437980	[-3.68333, 40.4]	2019-04-28 21:49:38	...Plaza de Santa Ana,Madrid-Spain 🏛#federicogarcialorca 🏛#archilovers 🏛#madrid_spain 🏛#arte_y_cultura 🏛#top_madrid_photo 🏛#living_europe🌏 🏛#kings_luxury… https://t.co/roqEor648a	🏛#federicogarcialorca 🏛#archilovers 🏛#madrid_spain 🏛#arte_y_cultura 🏛#top_madrid_photo 🏛#living_europe🌏 🏛#kings_luxury plaza de santa ana madrid-spain
1122588714314752000	177978233	null	2019-04-28 21:49:40	@Juanma_Toribio Eso estaba clarinete	@juanma_toribio ese estar clarinete
1122588729087074304	569315935	null	2019-04-28 21:49:44	@CasalIratxe Qué ha pasado??? Yo voté por correo	@casaliratxe qué haber pasar yo votar por correo
1122588732018888711	589812371	null	2019-04-28 21:49:45	@IlusionRecuerdo @algoqrecordar @objetivo_viajar @visita_Holanda @lagran_escapada @lacosmopolilla @LaMochiladeMama @mochilerostv @viajefilos @pekebikers Pero ¡qué bonito el parque! Allí no me importaría ir al ritmo infinitamente lento... Creo que os retrasaría aún más que los exploradores ;) #IlusiónHolanda	@ilusionrecuerdo @algoqrecordar @objetivo_viajar @visita_holanda @lagran_escapada @lacosmopolilla @lamochilademama @mochilerostv @viajefilos @pekebikers #ilusiónholanda pero qué bonito el parque allí no yo importar ir al ritmo infinitamente lento creer que tú retrasar aún más que el explorador
1122588742915633158	557990225	null	2019-04-28 21:49:47	Increible	increible
1122588749752356864	1315568941	null	2019-04-28 21:49:49	Bien ahí, ayudando una jornada más a los equipos de la capital.	bien ahí ayudar uno jornada más el equipo de el capital
1122588749496557568	1613818555	null	2019-04-28 21:49:49	@rightzara pero es q siempre esta presente https://t.co/ztuNEbLqTJ	@rightzara pero ser siempre este presente
1122588753195872257	108285684	null	2019-04-28 21:49:50	Toc toc está Susana Díaz ? Que se ponga..	toc toc estar susano díaz que él poner
1122588753560834048	16798736	[-3.65847981, 40.39193135]	2019-04-28 21:49:50	#SienteQuiénTeGuardaLasEspaldas Lamentable que en cualquier campo la afición pese más que en el Bernabéu... en Estadio de Vallecas https://t.co/ZLYrN2aI1f	#sientequiénteguardalasespaldas lamentable que en cualquiera campo el afición pese más que en el bernabéu en estadio de valleca
1122588763442569217	715569216905207808	null	2019-04-28 21:49:52	@alimadeo606 Hombreeeee y luego a estudiar para la evau oleeee 😝🤙	@alimadeo606 hombreeeeer luego estudiar para el evau oleeee 😝🤙
1122588763941736448	1007367276	null	2019-04-28 21:49:52	No voy a entrar a Twitter hasta que no termine el recuento nos vemo	no ir entrar twitter hasta que no terminar el recuento yo ver
1122588765355163650	58945663	null	2019-04-28 21:49:53	@julenn26 ¿y quién ha dicho Viva mi abuela que vota a izquierdas??lo has soñado quizás Ay, por favor... Paz y amor	@julenn26 quién haber decir viva mi abuela que vota izquierda él haber soñar quizás ay por favor paz amor
1122588770421936129	2509144397	null	2019-04-28 21:49:54	Ninguna justificación te hará ganar un partido ... deberías aprender de Toni Nadal	ninguno justificación tú hacer ganar uno partido deber aprender de toni nadal
1122588788440494081	1098504872507424768	[-3.85889, 40.32778]	2019-04-28 21:49:58	Como ya veníamos anunciando, volvemos a la Inferno's el 10 de mayo! Con unas ganas que flipais de enseñaros nuestros temitas y pasar un rato de la hostia!!! 🤘🏽🤘🏽🤘🏽 .  Ahí estaremos con @PVbandpunk y @derrocados  .… https://t.co/2HmH1K0uMs	@pvbandpunk @derrocados como ya venir anunciar volver él inferno el 10 de mayo con uno gana que flipais de enseñaro nuestro temita pasar uno rato de el hostia 🤘🏽🤘🏽🤘🏽 ahí estar con
1122588798930571265	240431750	null	2019-04-28 21:50:01	Esto está de lo más tranquilo. 😇 #EleccionesL6 #28A	#eleccionesl6 #28a este estar de el más tranquilo
1122588801065541635	2907650823	null	2019-04-28 21:50:01	Galicia 0 escaños a Vox bueno menos mal:____ Dentro de lo malo https://t.co/8CUMYJbFiY	galicia escaño vox bueno menos mal dentro de el malo
1122588825304350723	416973541	[-3.68936, 40.45309]	2019-04-28 21:50:07	🦄Buenas noches Familia!!! 💁🏼‍♀️Cómo pasa el tiempo!!! Hace un año preparábamos una sesión para el 🌱🌱🌱catálogo de alimentación de @caleyaforrajes gracias a caleya_horses_madrid… https://t.co/6qK88yiIfr	@caleyaforrajes 🦄buen noche familia 💁🏼‍♀️cómo pasar el tiempo hacer uno año preparar uno sesión para el 🌱🌱🌱catálogo de alimentación de gracias caleya_horses_madrid
1122588863397081089	364469473	null	2019-04-28 21:50:16	Calienta Feijóo...	calienta feijóo
1122588897186340866	15343430	null	2019-04-28 21:50:24	Yo creo que Casado debe dimitir ya como Presidente del PP y que el PP desaparezca. Ni con Fraga ha estado tan bajo el PP	yo creer que casado deber dimitir ya como presidente del pp que el pp desaparecer ni con fraga haber estar tanto bajo el pp
1122588897245048837	2760665212	null	2019-04-28 21:50:24	@sanchezcastejon no nos defraudes! PSOE + PODEMOS ❤️💜💪🏼	@sanchezcastejon no yo defraud psoe poder ❤
1122588897278431233	1054185247	[-3.70350478, 40.41711534]	2019-04-28 21:50:24	Escapada express con naldo_c_d Y su nuevo camarón🍤📷 . . . . . . . . #world_bestangels #world_besthdr #world_bestsky #great_capture #zara #escada #illife_woman #igw_portraits #ig_street… https://t.co/bIvNVGeBeV	#world_bestangels #world_besthdr #world_bestsky #great_capture #zara #escada #illife_woman #igw_portraits #ig_street escapado express con naldo_c_d su nuevo camarón🍤📷
1122588901896544257	206739193	null	2019-04-28 21:50:25	Son mis mejores deseos	ser mi mejor deseo
1122588902181756930	711315165	null	2019-04-28 21:50:25	@StillRodrigo Esa es la dura vida que me ha tocado llevar, doy opiniones gratis sin compriso JAJAJ	@stillrodrigo ese ser el duro vida que yo haber tocar llevar doy opinión gratis sin compriso jajaj
1122588903473655808	2499325446	null	2019-04-28 21:50:25	Ya me da igual todo. Solo quiero ver la cara de Casado...	ya yo dar igual todo solo querer ver el cara de casado
1122588909886758915	612698606	null	2019-04-28 21:50:27	Y mañana la batalla de Invernalia.  Yo me muero XD	mañana el batalla de invernalia yo yo morir xd
1122588912709447682	139410714	null	2019-04-28 21:50:28	@Dasrij Si si. Va a pasar a Cs y Podemos yo creo. Yo con mi mesa... Me hace ser muy pesimista	@dasrij si si ir pasar cs poder yo creer yo con mi mesa yo hacer ser mucho pesimista
1122588928618442758	777719389	null	2019-04-28 21:50:31	Los de la banderita en Colón, que sirva pa limpiarse las lágrimas	el de el banderita en colón que servir pa limpiarse el lágrima
1122588932120694784	1211280823	null	2019-04-28 21:50:32	Bien @RealZaragoza ,espero la semana que viene poder ir al campo .	@realzaragoza bien esperar el semana que venir poder ir al campo
1122588933978767367	521382364	null	2019-04-28 21:50:33	@ElHuffPost El día que haya un muerto por síncope lo peta 100%de audiencia ???y eso sería bueno ???preguntas y nadie lo ve ???no se qué pasa	@elhuffpost el día que haber uno muerto por síncope él petar 100%de audiencia ese ser buen pregunta nadie él ver no él qué pasar
1122588940790378500	382201725	null	2019-04-28 21:50:34	@bellaindomita Me temo que solo el Rayo Vallecano nos va a dar una alegría...puff	@bellaindomita yo temer que solo el rayo vallecano yo ir dar uno alegría puff
1122588947648065540	955526552	null	2019-04-28 21:50:36	@Pili130373 Buenas noches Pili	@pili130373 buen noche pili
1122588962487402496	56528100	null	2019-04-28 21:50:40	@chevengur_ @chicabanda @laSextaTV De no creerlo. Los mismos discursos de la ultra derecha que también pululan por allá.	@chevengur @chicabanda @lasextatv de no c el mismo discurso de el ultro derecho que también pulular por allá
1122588974013456386	612660405	null	2019-04-28 21:50:42	Mi amiga emocionada pq su partido (x un Mundo + Justo) tenga 4 votos en el Barrio Salamanca me alegra el corazón💓 Sarita, te adoro. Por tu idealismo, bondad, ilusión y generosidad, pero, sobre todo, pq tus ganas de hacer del mundo un lugar mejor se traducen en actos.	mi amiga emocionado pqr su partido uno mundo justo tener voto en el barrio salamanco yo alegrar el corazón💓 sarita tú adorar por tu idealismo bondad ilusión generosidad pero sobre todo pq tu gana de hacer del mundo uno lugar mejor él traducir en acto
1122588975376535552	16978640	null	2019-04-28 21:50:43	Y el otro venga a decir q antes el PSOE bajaba según subía el escrutinio. Ha dicho lo mismo 15 veces ya. Ferreras, cállalo! #elecciones	#elecciones el otro venir decir antes el psoe bajar según subir el escrutinio haber decir el mismo 15 vez ya ferrero cállalo
1122588976290910208	59436470	null	2019-04-28 21:50:43	Que en el juego del parlamento la cosa va de sumar y tal. Era votar para conseguir lo del primer tuit, sin más, sabiendo que votar solo sirve para eso. De que sirve en ese contexto votar a un partido que saca 4.000 votos? Eso sí que ha dado que sume PSOE con C's...	que en el juego del parlamento el cosa ir de sumar tal ser votar para conseguir el del primero tuit sin más saber que votar solo servir para ese de que servir en ese contexto votar uno partido que sacar 000 voto ese sí que haber dar que sumir psoe con
1122588977926692866	59436470	null	2019-04-28 21:50:43	Es la primera vez que no voto por ideología a un partido que no sacaría diputado, he votado para cumplir lo del primer tuit, estoy cansado de reproches.	ser el primero vez que no votar por ideología uno partido que no sacar diputado haber votar para cumplir el del primero tuit estar cansado de reproche
1122588978576863232	266238057	null	2019-04-28 21:50:43	ESPAÑA ES ROJA Y PROGRESISTA. ¡VIVA ESPAÑA!	españa ser roja progresista vivo españa
1122588981017960448	363102095	null	2019-04-28 21:50:44	@AlbiolsPons @espana_atletico @macajime1 @MariaTe09466176 De verdad, que veo 23,y me dan ganas de llorar	@albiolspons @espana_atletico @macajime1 @mariate09466176 de verdad que ver 23 yo dar gana de llorar
1122588995442151424	1436220277	null	2019-04-28 21:50:47	Primeras imágenes de @vox_es tras su hostia histórica #GraciasEspaña #MariconesSiPodemos #EleccionesL6 #ElecccionesGenerales28A #28A https://t.co/AqvuXnoZ82	@vox_es #graciasespaña #mariconessipodemos #eleccionesl6 #elecccionesgenerales28a #28a primero imagen de tras su hostia histórico
1122589000911532032	262150489	null	2019-04-28 21:50:49	En Madrid ahora mismo el PP es el 4 vaya hostia niño	en madrid ahora mismo el pp ser el vaya hostia niño
1122589004136947718	711315165	null	2019-04-28 21:50:49	@StillRodrigo Compromiso* que no se escribir	@stillrodrigo compromiso que no se escribir
1122589021446770690	1455039001	null	2019-04-28 21:50:54	@CervantesFAQs @Mcpey9E @vox_es @Irene_Montero_ .Si tienen cara de jili.sin gobernar.q cara https://t.co/u7DtYUVo9W gobernaran.	@cervantesfaqs @mcpey9e @vox_es @irene_montero si tener cara de jili sin gobernar cara gobernar
1122589034868559877	351439314	null	2019-04-28 21:50:57	La derecha no suma. #EleccionesGenerales28Abril	#eleccionesgenerales28abril el derecha no sumar
1122589056280551424	1616501376	null	2019-04-28 21:51:02	@Lupo23908507 @rosadiezglez Pues vaya socialista mas asquerosa	@lupo23908507 @rosadiezglez pues ir socialista mas asqueroso
1122589059073892352	715569216905207808	null	2019-04-28 21:51:03	Buah esto en realidad me está motivando muchisimo para finalmente estudiar política	buaar este en realidad yo estar motivar muchisimo para finalmente estudiar política
1122589060659388421	626699140	null	2019-04-28 21:51:03	Medio sanblas y medio barrio en la conce😂	medio sanbla medio barrio en el conce😂
1122589078535528448	262150489	null	2019-04-28 21:51:07	@RayRichard3 @Lolo_barba Pero mucho	@rayrichard3 @lolo_barba pero mucho
1122589081542770688	1436220277	null	2019-04-28 21:51:08	Donde están esos de #Vox que decían que sacarían 70 escaños? Donde que no los veo?	#vox donde estar ese de que decir que sacar 70 escaño donde que no él ver
1122589108247855104	824057798	null	2019-04-28 21:51:14	Es imposible tratar de gobernar sin rascar aunque sea UN POCO en Cataluña y País Vasco. El PP no existe allí y en Valencia empieza a ser un problema.   Es lo que tiene haber mirado hacia otro lado muchos años.	ser imposible tratar de gobernar sin rascar aunque ser uno poco en cataluña país vasco el pp no existir allí en valencia empezar ser uno problema ser el que tener haber mirar hacia otro lado mucho año
1122589110529593344	575480047	null	2019-04-28 21:51:15	Cualquiera se enamora.🎶😎	cualquiera él enamorar 🎶😎
1122589127042531328	2278033702	null	2019-04-28 21:51:19	@iescolar Los vascos sí que son diferentes.Tienen mucha razón en considerarse una nación independiente. Toda mi admiración y mi respeto para Euskal eHrría.	@iescolar el vasco sí que ser diferente tener mucho razón en considerarsar uno nación independiente todo mi admiración mi respeto para euskal ehrr
1122589147418570752	283199023	null	2019-04-28 21:51:24	¿Lo oyen? Si, es la hostia que se ha metido el PP   #EleccionesL6 https://t.co/HAIZjcLy3h	#eleccionesl6 él oír si ser el hostia que se haber meter el pp
1122589158294343680	314116527	null	2019-04-28 21:51:26	@Captain_Baul @serena_pj Y ahora no me dejan ní desplegarlo, puto fútbol moderno, no?	@captain_baul @serena_pj ahora no yo dejar ní d puto fútbol moderno no
1122589166540341250	3402076019	null	2019-04-28 21:51:28	Me siento raro y no se xrq es, lo odio	yo sentir raro no se xrirr ser el odio
1122589168918499328	126599760	null	2019-04-28 21:51:29	"@el_pais Trtrstado! Pobre ""señor""!"	@el_pais trtrstar pobre señor
1122589170621460481	521382364	null	2019-04-28 21:51:29	@diezminutos_es Si te quieres quedar en T5 ya sabes ...	@diezminutos_es si tú querer quedar en t5 ya saber
1122589176711585795	1975556024	null	2019-04-28 21:51:31	Pues una pena que no podamos ver las finales de #FaseAscensoLigaDIA #RiosTejera #Tenerife en #CanalFeb @BaloncestoESP pero un lujo escuchar los comentarios de @Maria_Sosa_ en @facebook ahora @CBClarinos 34-24 @cbalmeria comenzando 3Q https://t.co/JDO6eegAo4	#faseascensoligadia #riostejera #tenerife #canalfeb @baloncestoesp @maria_sosa @facebook @cbclarinos @cbalmeria pues uno pena que no podar ver el final de en pero uno lujo escuchar el comentario de en ahora 34-24 comenzar 3q
