tweetId	authorId	coordinates	date	text	lemmatizedText
1122441637135822849	76999095	[-3.8, 40.2833]	2019-04-28 12:05:14	Después de votar, toca terraceo. en Fuenlabrada, Madrid, Spain https://t.co/VvhKaT6Yqs	después de votar tocar terraceo en fuenlabrado madrid spain
1122441707163922438	80856048	null	2019-04-28 12:05:31	Yo cuando veo desde la cocina cómo matan todo el rato a mi novio en el Days Gone. https://t.co/B499O2GgXZ	yo cuando ver desde el cocina cómo matar todo el rato mi novio en el days gone
1122441741821521921	721829339214561280	null	2019-04-28 12:05:39	@Lioferro_sluna Es que ayer mi familia diciendome que ante todo, democraciq... Que quieres que te diga, la democracia acaba cuando se quieren cargar mis derechos	@lioferro_sluna ser que ayer mi familia diciendome que ante todo democraciq que quere que tú decir el democracia acabar cuando se querer cargar mi derecho
1122441752089169920	607277441	null	2019-04-28 12:05:42	@vox_es Si es que no dais para más.	@vox_es si ser que no dais para más
1122441758552444928	2613612061	[-3.69901, 40.39959]	2019-04-28 12:05:43	Hoy termina el curso de Improvisación para televisión, impartido por @robertolealg en nuestro plató.  Pero en mayo habrá otro, cuando? Consulta toda la información en su perfil @improtele… https://t.co/IjkCRlOtyZ	@robertolealg @improtele hoy terminar el curso de improvisación para televisión impartido por en nuestro plató pero en mayo haber otro cuando consultar todo el información en su perfil
1122441759827595264	356283950	null	2019-04-28 12:05:44	¿Cuánto tiempo se tiene que estar sin decir nada de #AvengersEndgame para evitar un spoiler?	#avengersendgame cuánto tiempo se tener que estar sin decir nada de para evitar uno spoiler
1122441760133799936	2531469550	null	2019-04-28 12:05:44	Cuando sales a dar un paseo para pensar lo que nos deparan los próximos dias y a menos de 10 minutos del centro te encuentras esto.... #alcaladehenares es cultura, es historia, es naturaleza 💕💕💕 https://t.co/iyXe3SRuPi	#alcaladehenares cuando sal dar uno paseo para pensar el que yo deparar el próximo dias menos de 10 minuto del centro tú encontrar este ser cultura ser historia ser naturaleza 💕💕💕
1122441770841837570	402750573	null	2019-04-28 12:05:46	Felicidades a nuestros amigos de @IntersoccerM por conseguir el ansiado ascenso del Juvenil. ¡Ahora a por el senior! #todoalverde💚💚	@intersoccerm #todoalverde💚💚 felicidad nuestro amigo de por conseguir el ansiado ascenso del juvenil ahora por el senior
1122441818056974337	4061804691	[-3.47362791, 40.43255567]	2019-04-28 12:05:58	VESTIDO CUZCO❤️ #ss19 #vestidoCuzco 👀 @TeresadelValle1 @fuenalbaladejo 📸🥤@eliasastre - Pendientes de verbenamadrid en Palacio De Aldovea https://t.co/SGn6gWRcD9	#ss19 #vestidocuzco @teresadelvalle1 @fuenalbaladejo 📸🥤@eliasastre vestido cuzco❤️ pendiente de verbenamadrid en palacio de aldovea
1122441821681082368	4850474879	null	2019-04-28 12:05:58	@mimentidero ¿España está llena de fosas y tiros en la nunca pero tu parece que apuestas solo por un bando pasa página y deja de engañar. todos tenemos un muerto en una cuneta y en una sima?	@mimentidero españa estar lleno de fosa tiro en el nunca pero tu parecer que apuesta solo por uno bando pasar página dejar de engañar todo tener uno muerto en uno cuneta en uno simo
1122441845668184065	123385139	null	2019-04-28 12:06:04	A ver cuando desarrollan una aplicación para que podamos votar en el móvil desde casa, o desde donde sea. #EleccionesGenerales28A	#eleccionesgenerales28a ver cuando desarrollar uno aplicación para que poder votar en el móvil desde casa desde donde ser
1122441864718712832	3580590435	null	2019-04-28 12:06:09	me copio de Luis, fav y te asigno una canción de Sia https://t.co/U2x0jBFQ5S	yo copiar de l fav tú asignar uno canción de sia
1122441868200095744	457591889	null	2019-04-28 12:06:09	@Rojiblanco_ATM Es decir, si pacta con Sánchez si se acaba con el bipartidismo, no..?	@rojiblanco_atm ser decir si pactar con sánchez si se acabar con el bipartidismo no
1122441894666080257	287663093	[-3.66666667, 40.5]	2019-04-28 12:06:16	Acaba de publicar una foto en Community of Madrid https://t.co/mkQid8QmnJ	acabar de publicar uno foto en community of madrid
1122441896020803584	2413539267	null	2019-04-28 12:06:16	Mucha afluencia en Villanueva del Pardillo  #28AUnidasPodemos https://t.co/NQaMz9zSyB	#28aunidaspodemos mucho afluencia en villanueva del pardillo
1122441905474809856	1031262625685012480	null	2019-04-28 12:06:18	@Imperialmeme Espera que se declare la alerta antifascista	@imperialmeme esperar que se declarar el alerta antifascista
1122441907253260289	206247408	null	2019-04-28 12:06:19	@engleslixxz Hermosa lo que sos	@engleslixxz hermoso el que so
1122441932117086208	199234390	null	2019-04-28 12:06:25	@Iko1986 @NenoAluXe @Jemgar1 Anuncia un samsung en una foto con un huawei. Es como hacerse una foto con la camiseta del real madrid en el camp nou.	@iko1986 @nenoaluxe @jemgar1 anunciar uno samsung en uno foto con uno huawei ser como hacerse uno foto con el camiseta del real madrid en el camp nou
1122441962064437248	4850474879	null	2019-04-28 12:06:32	@Masara48810945 ¿Antes de votar a Podemos me corto la mano?	@masara48810945 antes de votar poder yo corto el mano
1122441968934584327	316572612	null	2019-04-28 12:06:34	@martinfd78 😱😱😱😱😱😱😱😱😱😱😱 Que horror.	@martinfd78 😱😱😱😱😱😱😱😱😱😱😱 que horror
1122441970629140480	75689066	null	2019-04-28 12:06:34	Bien, ahora a defender los poster! Vamos! #EMS2019	#ems2019 bien ahora defender los poster ir
1122441983610490880	2700385384	null	2019-04-28 12:06:37	Ni cárcel, ni expulsión........ 9mm.	ni cárcel ni expulsión 9mm
1122441987637096448	2287290306	null	2019-04-28 12:06:38	A punto de comenzar el espectáculo, 'ópera-mía' en @CaixaForum #Madrid Gracias @pablodemallorca #operapassion https://t.co/KRQgoDqipy	@caixaforum #madrid @pablodemallorca #operapassion punto de comenzar el espectáculo ópera-mía en gracias
1122442018184151041	110640014	null	2019-04-28 12:06:45	@LauriiFlowers corriendo voy de verdad.	@lauriiflowers correr ir de verdad
1122442054657892353	471309337	null	2019-04-28 12:06:54	Mi apuesta para hoy:  🌹 26.3% 💧 19.2% 🍆 18.2% 🥦 14,9% 🍊 14.5%  #EleccionesGenerales28A #28A	#eleccionesgenerales28a #28a mi apuesta para hoy 26 3 19 2 18 2 14 9 14 5
1122442078003183616	282074751	[-3.69611, 40.42254]	2019-04-28 12:07:00	Muy muy pronto los bañadores nuevos. Yo ya tengo los prototipos en mi poder y aunque esté mal que lo diga yo creo que me he superado 😁😁 #ilustrador #madrid #chueca #swimsuit… https://t.co/dJQ5Y0q2Hg	#ilustrador #madrid #chueca #swimsuit mucho mucho pronto el bañador nuevo yo ya tener el prototipo en mi poder aunque estar mal que él decir yo creer que yo haber superar 😁😁
1122442085989265408	2276604019	null	2019-04-28 12:07:01	@jcarlosmendi @electo_mania Si, en todas JAJAJAAJ Pregúntele usted a alguien en Madrid si existe la hora del vermú entre semana, o si se sale siempre a las 5, en cuánto tiempo se come, cuánto perdemos en movilidad y una larga lista de etcéteras xk conozco y he vivido en otras ciudades de otras provincias.	@jcarlosmendi @electo_mania si en todo jajajaaj pregúnteler tú alguien en madrid si existir el hora del vermú entre semana si se salir siempre él en cuánto tiempo se comar cuánto perder en movilidad uno largo lista de etcétera xk conocer haber vivir en otro ciudad de otro provincia
1122442118239334401	721829339214561280	null	2019-04-28 12:07:09	@laugheverx Que suerte, yo no tengo tanta tolerancia. Creo que se me notaria demasiado😂	@laugheverx que sortir yo no tener tanto tolerancia creer que se yo notariar demasiado😂
1122442118499270656	192191876	[-3.8647, 40.3218]	2019-04-28 12:07:09	Desde Serenade a Vetusta Morla, cuanto hemos crecido juntos 🤞🏻❤️ en Móstoles, Madrid, Spain https://t.co/Ff6h3aRdJp	desde serenade vetusta morlo cuanto haber crecer junto 🤞🏻❤️ en móstol madrid spain
1122442132831244289	2268526492	null	2019-04-28 12:07:13	@LauraERamos98  no te puedes ni imaginar lo que te eché en falta ayer cuando estuve viendo a Pablo 🥺	@lauraeramos98 no tú poder ni imaginar el que tú echar en falta ayer cuando estar ver pablo
1122442160740208641	457775261	null	2019-04-28 12:07:19	¿Se puede ser más pillín? https://t.co/ELbJuoBxYB	se poder ser más pillín
1122442209599553536	117706447	null	2019-04-28 12:07:31	Pues a ver el juego final	pues ver el juego final
1122442213038927873	827159793198571525	null	2019-04-28 12:07:32	Presiento fuego y destruccion	presiento fuego destruccion
1122442230248165376	1109775315390382080	null	2019-04-28 12:07:36	Despues de mucho pensar voy a votar a Unidas Podemos, prefiero una mayoria de izquierda antes de que vox pueda tener derecho a algo.	despues de mucho pensar ir votar unido poder preferir uno mayoria de izquierda antes de que vox poder tener derecho algo
1122442242487148545	134528550	null	2019-04-28 12:07:39	La ilusión de votar...	el ilusión de votar
1122442253363023877	287338725	null	2019-04-28 12:07:41	@nacho_u Y el mus? O eso va en el paqueteVox?	@nacho_u el mus ese ir en el paquetevox
1122442263232221184	870723170	null	2019-04-28 12:07:44	Las imágenes lo dicen todo @pedrobonofiglio  Para l@s q hablan sin saber....🤫🤫	@pedrobonofiglio l@s el imagen él decir todo para él hablar sin saber 🤫🤫
1122442327136579585	244901083	null	2019-04-28 12:07:59	@SolisDomi @AD_Alcorcon @madridaltanto Que rica!!!	@solisdomi @ad_alcorcon @madridaltanto que rico
1122442328814366720	278486990	null	2019-04-28 12:07:59	Acabo de discutir con mi tío, de Vox, porque va a llevar a mi abuela, con Alzheimer y que no sabe ni quien se presenta, a votar. Por supuesto, a Vox.	acabar de discutir con mi tío de vox porque ir llevar mi abuela con alzheimer que no saber ni quien se presentar votar por supuesto vox
1122442339841204225	366633608	null	2019-04-28 12:08:02	Hemos empezado muy mal el comienzo RmCastilla vamos espabilarnos apretar mas concentrados sin cometer errores serios atras no perder balones tontos mas cojones morir en el campo mas fuertes todos movilidad rápida de balon presión alta remontar el partido es fundamental ganar hoy	haber empezar mucho mal el comienzo rmcastilla ir e apretar mas concentrado sin cometer error serio atro no perder balón tonto mas cojón morir en el campo mas fuerte todo movilidad rápido de balon presión alto remontar el partido ser fundamental ganar hoy
1122442337270075392	404761039	null	2019-04-28 12:08:01	Partido del @UnionAdarve frente al @PontevedraCFSAD https://t.co/ot3vgns8Xm	@unionadarve @pontevedracfsad partido del frente al
1122442399681269760	236427549	null	2019-04-28 12:08:16	@Raul_Dolcet ¡Por supuesto que he votado! Lo hice por correo hace días, que la situación es grave. 😉😉 ¡Muchas gracias, un abrazo!	@raul_dolcet por supuesto que haber votar él hacer por correo hacer día que el situación ser grave 😉😉 mucho gracia uno abrazo
1122442405918146562	29692320	null	2019-04-28 12:08:18	En @madrid no me dejan circular con mi coche por el centro por la contaminacion que generan las calefacciones comunitarias, y han agrandado las aceras para los peatones. El comunismo es una gran mentira. https://t.co/dOfnWqpbl1	@madrid en no yo dejar circular con mi coche por el centro por el contaminacion que generar el calefacción comunitario haber agrandar el acera para el peatón el comunismo ser uno gran mentira
1122442411995803648	6319662	null	2019-04-28 12:08:19	@OscarFeito Es recomendable Oscar??	@oscarfeito ser recomendable oscar
1122442419209953280	278486990	null	2019-04-28 12:08:21	Esta es la democracia que quieren. Votemos todos, por favor.	este ser el democracia que querer voter todo por favor
1122442428743606273	715569216905207808	null	2019-04-28 12:08:23	@davemylight Pues Psoe	@davemylight pues psoe
1122442464873336834	811244228919566337	null	2019-04-28 12:08:32	Elecciones en España 🇪🇸 la derecha Ganará.... https://t.co/o6iXAkjrUz	elección en españa 🇪🇸 el derecha ganar
1122442510742315009	134616581	null	2019-04-28 12:08:43	@alvaroga91 Woah, no duran mucho D:	@alvaroga91 woah no durar mucho d
1122442530451271680	110640014	null	2019-04-28 12:08:47	el vecino fue un borracho y un drogadicto y no se porque recibe ayudas pero dejo de trabajar hace muchos años asi para que entendáis un poco mas.	el vecino ser uno borracho uno drogadicto no se porque recibir ayuda pero dejo de trabajar hacer mucho año asi para que entender un poco mas
1122442566471946240	268205101	null	2019-04-28 12:08:56	@ElleTedesko Para eso tendrían que gobernar. Ahora ganará el PP y pagarás menos impuestos para que puedas seguir pagando lo mismo a tus empleado y hablando más. Hipócrita. Véase ERE de la empresa Bardem y su desprecio a los trabajadores.	@elletedesko para ese tener que gobernar ahora ganar el pp pagar menos impuesto para que podar seguir pagar el mismo tus empleado hablar más hipócrita véase ere de el empresa barder su desprecio el trabajador
1122442569424822272	1441911853	null	2019-04-28 12:08:57	Yo ya he votado!! casualidades de la vida en @MedialabPrado, gracias a todos los miembros de mesa e interventoras!!  #EleccionesGenerales28A https://t.co/37V0vBKkyv	@medialabprado #eleccionesgenerales28a yo ya haber votar casualidad de el vida en gracias todo el miembro de mesa interventor
1122442575187718144	627603028	null	2019-04-28 12:08:58	@ginercarrio @herrer05 @vox_es @Santi_ABASCAL @Ortega_Smith @monasterioR @ivanedlm No hay apoderados? Tiene que haber en todos lo colegios las mismas papeletas de todos  los partidos, de eso se encarga la mesa. Puede ser que la gente las quite, para eso denunciar y parar elecciones hasta que se resuelva.	@ginercarrio @herrer05 @vox_es @santi_abascal @ortega_smith @monasterior @ivanedlm no haber apoderado tener que haber en todo el colegio el mismo papeleta de todo el partido de ese él encargar el mesa poder ser que el gente él quitar para ese denunciar parar elección hasta que se resolver
1122442676207529984	260303681	null	2019-04-28 12:09:22	vota enrique pastor, otra comunidad es posible	vota enricar pastor otro comunidad ser posible
1122442695413248002	314730826	null	2019-04-28 12:09:27	Quién ha contestado a esto que no puedo verlo :0	quién haber contestar este que no poder v 0
1122442704753963008	1068299541303230466	null	2019-04-28 12:09:29	Me da miedo la cantidad de gente que Vota a vox	yo dar miedo el cantidad de gente que votar vox
1122442706389819393	567196464	null	2019-04-28 12:09:29	@BeitaMad13 @sanz_conde @Rickywislow @AdriLJ_28 @asantosan @cris_petit_ @rociintor Qué color más bonito en la playa	@beitamad13 @sanz_conde @rickywislow @adrilj_28 @asantosan @cris_petit @rociintor qué color más bonito en el playa
1122442742678925312	4696921824	null	2019-04-28 12:09:38	Imagen de la divina misericordia ♥️ https://t.co/tHgNxf2Ape	imagen de el divino misericordia ♥️
1122442752166383616	3171280527	null	2019-04-28 12:09:40	A quién tú consideres, por las razones que sean, pero VOTA!!! #EleccionesGenerales28Abril #VotaPorFavor https://t.co/QyRAyeby3G	#eleccionesgenerales28abril #votaporfavor quién tú conseder por el razón que ser pero votar
1122442785410437120	858965018955702272	null	2019-04-28 12:09:48	PORQUE NO EMPIEZAN JDR	porque no empezar jdr
1122442792775634945	612438596	null	2019-04-28 12:09:50	El horror en uno de los paises con más recursos naturales del mundo. Pero seguimos mirando para otro lado. Quien habla de @jguaido en las últimas semanas? La alternativa se ha diluido https://t.co/2Ztcz3ngmL	@jguaido el horror en uno de el pais con más recurso natural del mundo pero seguir mirar para otro lado quien hablar de en el último semana el alternativa él haber diluir
1122442837856067585	78270281	null	2019-04-28 12:10:01	Ya estaría. #EleccionesGenerales2019 #VotaConOrgullo https://t.co/fA215yyrHo	#eleccionesgenerales2019 #votaconorgullo ya estar
1122442849226821632	302314829	null	2019-04-28 12:10:03	Los venezolanos se dan un respiro de su terrible jornada de hambruna para ir al cine. https://t.co/JnR4QCcBxu	el venezolano él dar uno respiro de su terrible jornada de hambruna para ir al cine
1122442861990043648	432894620	null	2019-04-28 12:10:06	Luz a las cavernas Orgullo pijoprogre | Opinión | EL PAÍS https://t.co/6ftfjowI2F	luz el caverno orgullo pijoprogre opinión el país
1122442868675829760	4062511529	null	2019-04-28 12:10:08	GUITO’S  Carta cosmopolita y convencional con varios platos de origen sueco. Ambiente animado y servicio algo perdido, pero en conjunto buen sitio (el único, de momento) para probar cocina nórdica real. PUNTUACIÓN: 7,05 https://t.co/g2OxHQxSv9	guito’ carta cosmopolita convencional con varios plato de origen sueco ambiente animado servicio algo perdido pero en conjunto buen sitio el único de momento para probar cocina nórdico real puntuación 05
1122442880591831040	457591889	null	2019-04-28 12:10:11	@Rojiblanco_ATM Lo sorprendente, es q nuestra democracia no avance gracias a los enfrentamientos q producen los partidos entre unos y otros, q no seamos capaces de ver las cosas buenas d una u otra ideología, q no se pongan d acuerdo x ser d dcha, izq o liberal. Y estáis entrando en su juego.	@rojiblanco_atm el sorprendente ser nuestro democracia no avancer gracia el enfrentamiento producir el partido entre uno otro no ser capaz de ver el cosa buen uno otro ideología no se poner acuerdo ser dcha izq liberal estar entrar en su juego
1122442896127533056	5155011	null	2019-04-28 12:10:15	@nigirideatun Se llama odio contra los que no son como ellos. PUTO ASCO	@nigirideatun él llamar odio contra el que no ser como él puto asco
1122442901613613058	532285099	null	2019-04-28 12:10:16	Hazlo como si ya no te jugaras nada, como si fueras a morir mañana, aunque lo veas demasiado hueco. Hazlo como si no supieras que se acaba, como si fueras a morir mañana!  #Vota #EleccionesGenerales28A	#vota #eleccionesgenerales28a hazlar como si ya no tú jugarar nada como si ser morir mañana aunque él vear demasiado hueco hazlar como si no superar que se acabar como si ser morir mañana
1122442913034715136	34249334	null	2019-04-28 12:10:19	@guillegarciahoz Callos no pero una orejita plancha bien fritita con limón... https://t.co/TX2FI55Pw1	@guillegarciahoz callo no pero uno orejito plancha bien frititar con limón
1122442929098895360	333038778	null	2019-04-28 12:10:22	Ayer se escamotea un penalti clarísimo al Valladolid y una falta previa de Griezzman... Todo por ayudar al Girona... Que venga @isaacfouto a vender que no está preparado todo ...	@isaacfouto ayer se escamotear uno penalti claro al valladolid uno falta previo de griezzmar todo por ayudar al girona que venir vender que no estar preparado todo
1122442939035213825	869972136	null	2019-04-28 12:10:25	veo a este personaje votando en mi Pablo Sorozabal y 654 gapos se lleva mínimo	ver este personaje votar en mi pablo sorozabal 654 gapo se llevar mínimo
1122442940779986945	1353852332	null	2019-04-28 12:10:25	Teniendo que currar hoy, menos mal que voté por correo #28A	#28a tener que currar hoy menos mal que votar por correo
1122442942285742081	1265536442	null	2019-04-28 12:10:26	@Proas70 Domingo de #EleccionesGenerales en el  #RomanValero del #PrefGr2 @RFFM_oficial para ver el @CDCMOSCARDO_com vs. @LosYebenesSB  37’ 0/1 (Aritz) #somosproas #working #scouting @ondamadrid @bernardoalf @jlpoblador @proas.org @Balon_Tierra @madridaltanto @PrefeMAT #BotaMat https://t.co/09sqWaEhMu	@proas70 #eleccionesgenerales #romanvalero #prefgr2 @rffm_oficial @cdcmoscardo_com @losyebenessb #somosproas #working #scouting @ondamadrid @bernardoalf @jlpoblador @proas @balon_tierra @madridaltanto @prefemat #botamat domingo de en el del para ver el vs 37’ 0/1 aritz org
1122442976364507136	1042522405523079168	null	2019-04-28 12:10:34	De verdad no mg VOX pero tampoco me gusta que se vayan inventado cosas de un partido cuando no son así, para manipular	de verdad no mg vox pero tampoco yo gustar que se ir inventar cosa de uno partido cuando no ser así para manipular
1122442985663283200	102080555	null	2019-04-28 12:10:36	@JRuizArcaute @horasperdidas Lo escuché anoche. Sensacional. Con sus peros y errores hay que reconocerle a Kevin Feige y Marvel esto	@jruizarcaute @horasperdidas él escuchar anoche sensacional con su pero error haber que r kevin feigir marvel este
1122443004948746240	2387667770	null	2019-04-28 12:10:41	@henarconh Que democrático todo, que lo ven como una batalla.	@henarconh que democrático todo que él ver como uno batalla
1122443022787018752	4850474879	null	2019-04-28 12:10:45	@BromiusBCN Yo no voto Ratas Comunistas...	@bromiusbcn yo no votar rata comunista
1122443048091357184	759854508	null	2019-04-28 12:10:51	#Madrid #Madridcofrade #LaPasionNoAcaba María Santísima de la Misericordia https://t.co/ATtVVW6ocW	#madrid #madridcofrade #lapasionnoacaba maría santísimo de el misericordia
1122443056500891648	465690120	null	2019-04-28 12:10:53	@SeatNeon @ritxinaval DIOS SI	@seatneon @ritxinaval dio si
1122443072355426304	591300561	null	2019-04-28 12:10:57	Hoy es el primer partido de la serie contra GSW. Pavor.	hoy ser el primero partido de el serie contra gsw pavor
1122443077455622144	1102548202362994688	null	2019-04-28 12:10:58	El Ayuntamiento de Boadilla estuvo presente durante la fase de ascenso. El apoyo, clave para la organización y el triunfo en el evento. #TENISDEMESA #tenisdemesa #rfetm #BoadilladelMonte https://t.co/zbyXL18gMO	#tenisdemesa #tenisdemesa #rfetm #boadilladelmonte el ayuntamiento de boadilla estar presente durante el fase de ascenso el apoyo clave para el organización el triunfo en el evento
1122443105167392768	450853334	null	2019-04-28 12:11:04	@sacedator Tardo un cuarto de hora en recogerte.	@sacedator tardo uno cuarto de hora en recogerte
1122443112486440962	429854926	null	2019-04-28 12:11:06	GOOOOOOOOOOOOL GOOOOOOOL del @cdeamistad  Gol de Gil, si de Gil, que se queda el balón tras el lanzamiento de falta y arma la pierna para un disparo perfecto.  @cdeamistad 2 - 2 San Ignacio de Loyola.  #VamosVerdes	@cdeamistad @cdeamistad #vamosverdes gooooooooooool goooooool del gol de gil si de gil que él quedar el balón tras el lanzamiento de falta arma el pierna para uno disparo perfecto ie ignacio de loyola
1122443131981574144	2700385384	null	2019-04-28 12:11:11	Normal, tiene que cobrar las deudas pendientes de pago.	normal tener que cobrar el deuda pendiente de pago
1122443147546697728	1112555132	null	2019-04-28 12:11:15	Voy a llegar tarde al cine? Si	ir llegar tarde al cine si
1122443165842190336	271996747	null	2019-04-28 12:11:19	.@InesArrimadas hace cola para votar en su colegio electoral. Tiene por delante una espera de casi una hora. Todo apunta a una alta participación https://t.co/vZVY7EaRY8	@inesarrimadas hacer cola para votar en su colegio electoral tener por delante uno espera de casi uno hora todo apuntar uno alto participación
1122443175648428033	4502217743	null	2019-04-28 12:11:21	@jordievole @xtianolive ¡Qué persona más maravillosa!. Grande Nacho, no sabemos lo que tenemos...lo adoro.	@jordievole @xtianolive qué persona más maravilloso grande nacho no saber el que tener el adoro
1122443189560979456	314730826	null	2019-04-28 12:11:25	@tenhofame Qué has hecho para estar tan precioso vamos a ver	@tenhofame qué haber hacer para estar tanto precioso ir ver
1122443221928488960	312813797	null	2019-04-28 12:11:32	@Tsevanrabtan @dante_h_r Y en ayunas (?)	@tsevanrabtan @dante_h_r en ayunas
1122443291432189952	175387235	null	2019-04-28 12:11:49	@RodrigoEspector @faustodobien Amigas todas. https://t.co/EukaOzwFRD	@rodrigoespector @faustodobien amigo todo
1122443337737355264	46524802	null	2019-04-28 12:12:00	Si hubiera listas abiertas en las #EleccionesGenerales28A y una sola circunscripción única la gente podría votar pensando en quien quiere que le represente y no en quien no quiere que gane. Además las campañas de los partidos y los resultados sería muy distintos. #leyElectoral	#eleccionesgenerales28a #leyelectoral si haber lista abierto en el uno solo circunscripción único el gente poder votar pensar en quien querer que él representar no en quien no querer que ganar además el campaña de el partido el resultado ser mucho distinto
1122443469660852225	711315165	null	2019-04-28 12:12:31	@pilarorozco2 Ojalá vernos este año ;-; https://t.co/K9PMSXg1eh	@pilarorozco2 ojalar verno este año
1122443490053578752	408671274	null	2019-04-28 12:12:36	@javierpmar Yo es que no entiendo que es tan difícil de entender... la verdad.	@javierpmar yo ser que no entender que ser tanto difícil de entender el verdad
1122443511075418113	594625034	null	2019-04-28 12:12:41	@albertsoleb Como no tiene sentido explicarte que significa violar las leyes, intentar impedir un mandato judicial y enfrentarse a la policía te ganas un block como una catedral para evitar leer más lloriqueos	@albertsoleb como no tener sentido explicarte que significar violar el ley intentar impedir uno mandato judicial enfrentarse el policía tú ganar uno block como uno catedral para evitar leer más lloriqueo
1122443539751813120	627773461	null	2019-04-28 12:12:48	@JaviTheIceman @elmundodechris Muy grande tu profesora. 😉	@javitheiceman @elmundodechris mucho grande tu profesora
1122443576716214272	918737090	null	2019-04-28 12:12:57	la persona más sosa dl mundo en mi casa right now	el persona más soso dl mundo en mi casa right now
1122443591090151425	314181990	null	2019-04-28 12:13:00	@teleoperador A mi también y con el PSOE parecemos del mismo partido	@teleoperador mi también con el psoe parecer del mismo partido
