tweetId	authorId	coordinates	date	text	lemmatizedText
1122445421169844224	31100007	null	2019-04-28 12:20:17	Os tratan como borregos en vuestra cara y no os dais cuenta... 🤦🏼‍♂️	tú tratar como borrego en vostro cara no tú dair cuenta 🤦🏼‍♂️
1122445435422040064	612698606	null	2019-04-28 12:20:20	Se me ha vuelto a soltar el puto bracket del colmillo inferior derecho, me lleva pasando ya desde hace 3 meses o así, no sé que coño pasa con ese bracket pero no se sujetan al diente, no aguantan la presión.	se yo haber volver soltar el puto bracket del colmillo inferior derecho yo llevar pasar ya desde hacer mes así no saber que coño pasar con ese bracket pero no él sujetar al diente no aguantar el presión
1122445439809273856	286797826	null	2019-04-28 12:20:21	@ramonzc_ He estado en la misma situación, a tal punto que una columna de papeletas de vox iba por menos de la mitad	@ramonzc haber estar en el mismo situación tal punto que uno columna de papeleta de vox ir por menos de el mitad
1122445453075853314	460875601	null	2019-04-28 12:20:24	JAJAJAJAJAJA	jajajajajaja
1122445457995726848	1884398202	null	2019-04-28 12:20:25	@evagbar Usted es del trifálico y se percibe en el texto.  💧🥝🍊	@evagbar tú ser del trifálico se percibir en el texto 💧🥝🍊
1122445527956828160	1031262625685012480	null	2019-04-28 12:20:42	@pabloharour Nótese la ironía de esto por favor	@pabloharour nótese el ironía de este por favor
1122445545010794496	1147398824	null	2019-04-28 12:20:46	Para la izquierda todo lo que no esté bajo su cuerda es facha...	para el izquierda todo el que no estar bajo su cuerda ser facha
1122445558021591041	3402864400	[-3.68333, 40.4]	2019-04-28 12:20:49	Nos volveremos a ver en Madrid, Spain https://t.co/fB6cZAjrfx	yo volver ver en madrid spain
1122445593547354112	225489521	null	2019-04-28 12:20:58	@Transxte ¿Pero seguro que era de VOX? ¿Lo llevaba tatuado? ¿Lo dijo antes de agredir? Lo digo porque si alguien me agrede, puede ser del partido que quiera? Condena la agresión, máxima pena para ese personaje y ya, no juzgues porque no es tú función	@transxte pero seguro que ser de vox él llevar tatuado él decir antes de agredir él decir porque si alguien yo agredar poder ser del partido que querer condena el agresión máximo peno para ese personaje ya no juzguir porque no ser tú función
1122445627252707329	254954784	null	2019-04-28 12:21:06	Vota como un sabio. https://t.co/TAB9zdqadA	votar como uno sabio
1122445674807746560	3399772227	null	2019-04-28 12:21:17	Yo no voy a perder la oportunidad de votar y elegir a quién quiero que me gobierne a votar!!! https://t.co/iiPbBeQWra	yo no ir perder el oportunidad de votar elegir quién querer que yo gobernar votar
1122445673054523392	99261980	null	2019-04-28 12:21:17	Vallecas sigue fiel a Podemos: todos cogiendo la misma papeleta. #EleccionesGenerales28Abril https://t.co/9qhbP37ILK	#eleccionesgenerales28abril valleca seguir fiel poder todo coger el mismo papeleta
1122445677496291328	3762709462	null	2019-04-28 12:21:18	Salgo x la tele rusa. C-r-e-o. https://t.co/3w3ZbqEdXB	salgar el tele ruso c-r-e-o
1122445687692693504	80613128	null	2019-04-28 12:21:20	@MarguiMu Estamos contigo	@marguimu estar éo
1122445708819410951	3148547254	null	2019-04-28 12:21:25	me voy a volver loca de tanto pensarlo	yo ir volver loco de tanto p
1122445711994425344	211318016	null	2019-04-28 12:21:26	"""Si suman las derechas, tendremos a Casado, o a Rivera, en Moncloa.  Si no suman, Pedro Sánchez puede gobernar, pero a saber con quién."" ""EL RECUENTO MÁS INCIERTO DE LA HISTORIA ELECTORAL"" (Por @mcampovidal) https://t.co/YKz2Lz7Rw3"	@mcampovidal si sumar el derecha tener casado rivera en moncloa si no sumar pedro sánchez poder gobernar pero saber con quién el recuento más incierto de el historia electoral por
1122445724795457536	78270281	null	2019-04-28 12:21:29	@beyonsesa Same here, menudo mal rollo.	@beyonsesa samer here menudo mal rollo
1122445752888897537	1359858536	null	2019-04-28 12:21:36	@alvaromartinbcs @populares Votar con la cabeza, el valor del PP está muerto por su traición, Rajoy y Casado tuvieron mayoría ABSOLUTA y no cambiaron nada del legado progre de ZP, chiringuitos de género, inmigración ilegal, persiguen al español en Galicia como si fueran ERC, valor seguro HOY es @vox_es	@alvaromartinbcs @populares @vox_es votar con el cabeza el valor del pp estar muerto por su traición rajoy casado tener mayoría absoluto no cambiar nada del legado progre de zp chiringuito de género inmigración ilegal perseguir al español en galicia como si ser erc valor seguro hoy ser
1122445756701523969	2700385384	null	2019-04-28 12:21:37	Puro peronismo de izquierdas...	puro peronismo de izquierda
1122445759008342017	711315165	null	2019-04-28 12:21:37	@middock JAJAJAJAJ si no es malo, yo soy igual o peor, pero las cosas como son 👀	@middock jajajajaj si no ser malo yo ser igual peor pero el cosa como ser
1122445769099882496	457591889	null	2019-04-28 12:21:40	@Rojiblanco_ATM Joder Nacho, que Sanchez es más veleta aún. Pero chico, para ti la perra gorda. Y ojo, no voto a ciudadanos.	@rojiblanco_atm joder nacho que sanchez ser más veleto aún pero chico para tú el perra gorda ojo no voto ciudadano
1122445781070483456	769704000	null	2019-04-28 12:21:42	Me he liado al votar, y en vez de preguntar a los que estaban para ayudar, le he preguntado a un diputado de VOX, me han podido los nervios...	yo haber liar al votar en vez de preguntar el que estar para ayudar él haber preguntar uno diputado de vox yo haber poder el nervio
1122445791619104769	80613128	null	2019-04-28 12:21:45	@JuliaBarNav Que va, casi nadie	@juliabarnav que ir casi nadie
1122445809809752066	524190495	null	2019-04-28 12:21:49	Esta canción me motiva mazo xd https://t.co/R6E9jj3SLV	este canción yo motivar mazo xd
1122445816923414529	724285422994657280	null	2019-04-28 12:21:51	Eii ayudaaa!! #Domingo de morir en la cama #BuenosDias https://t.co/f0apDZN2Yl	#domingo #buenosdias eiir ayudaaar de morir en el cama
1122445847634087936	1069300647382712320	[-3.68333, 40.4]	2019-04-28 12:21:58	#PERRESCALLEJERES realizará los días 11 y 12 de #mayo un curso de #iniciaciónALaGuitarra! 🎶🎸 en el que e aprenderán los conceptos básicos y a tocar los primeros #acordes! 😋  Todo el… https://t.co/LQnlWhJg1O	#perrescallejeres #mayo #iniciaciónalaguitarra #acordes realizar el día 11 12 de uno curso de 🎶 en el que aprender el concepto básico tocar el primero todo el
1122445853896126464	8078662	null	2019-04-28 12:22:00	Hala, ya he votado. Y como lo he hecho en conciencia y con ilusión, me recompenso como debe ser https://t.co/y2cJr6uvyD	hacer ya haber votar como él haber hacer en conciencia con ilusión yo recompensar como deber ser
1122445899752529920	153001705	null	2019-04-28 12:22:11	@PCAMPOS321 @Waxipola POR QUE GRITAS?	@pcampos321 @waxipola por que grita
1122445905716744192	67101023	null	2019-04-28 12:22:12	¡Día de elecciones! #28A  Ejerce tu derecho a elegir y recuerda que mañana queremos seguir en un presente con destino al futuro; y no una vuelta al pasado. https://t.co/itxnUKYspD	#28a día de elección ejercer tu derecho elegir recordar que mañana querer seguir en uno presente con destino al futuro no uno vuelta al pasado
1122445930022809600	1015966230	null	2019-04-28 12:22:18	No puedo ser más afortunada....🖇️💕	no poder ser más afortunado 🖇️💕
1122445946401558528	286797826	null	2019-04-28 12:22:22	Estás desaparecidx, que tal todo	estar desaparecidx que tal todo
1122445973878341632	2677751911	null	2019-04-28 12:22:28	@abn Y Twitter no? 😂	@abn twitter no
1122445972867624960	3762709462	null	2019-04-28 12:22:28	Las vistas. https://t.co/H5lPHblo0N	el vista
1122445985429561344	1081705702283010049	null	2019-04-28 12:22:31	Felicidades pesadilla ❤️ @9cande_	@9cande felicidad pesadillo ❤️
1122446001120468992	1081174765912637441	null	2019-04-28 12:22:35	Ayer hiciste que fuera uno de los mejores día de mi vida. Eres pura magia, tienes un corazón enorme @MaikelDLacalle 🤴🏻🖤 #urbanfest2019 https://t.co/2hDI3JjyhM	@maikeldlacalle #urbanfest2019 ayer hicistir que ser uno de el mejor día de mi vida ser puro magia tener uno corazón enorme 🤴🏻🖤
1122446024398839808	2700385384	null	2019-04-28 12:22:40	Sin estos socios, el PSOE no es nada.	sin este socio el psoe no ser nada
1122446044439171073	387643026	null	2019-04-28 12:22:45	Votad para que no ocurra lo que nos tenemos #28abril	#28abril votad para que no ocurrir el que yo tener
1122446099514523648	165158184	null	2019-04-28 12:22:58	@desdelci Hecho!	@desdelci hecho
1122446112978239489	711315165	null	2019-04-28 12:23:02	@PCAMPOS321 Lo he puesto que si sí que si no porque no estoy segura del todo... Tampoco es que tenga ser nada malo, pero lo tendré en cuenta😊	@pcampos321 él haber poner que si sí que si no porque no estar seguro del todo tampoco ser que tener ser nada malo pero él tener en cuenta
1122446138978783232	3320997965	null	2019-04-28 12:23:08	Acabo de votar, por primera vez. ¡La fiesta de la democracia 🗳! #28A #EleccionesGenerales28A	#28a #eleccionesgenerales28a acabar de votar por primero vez el fiesta de el democracia
1122446196168110087	3399772227	null	2019-04-28 12:23:21	@juancarlosmohr Pues no queremos libertad? No empezemos por prohibir quién debe, o no debe, quién puede o no puede estar...luego que cada uno elija	@juancarlosmohr pues no querer libertad no empener por prohibir quién deber no deber quién poder no poder estar luego que cada uno elegir
1122446196390240256	817419991591112704	null	2019-04-28 12:23:21	"""Q coñazo la nuca q valía la pena su madre"	coñazo el nuca valer el pena su madre
1122446211829649408	803364853	null	2019-04-28 12:23:25	Y otro de los talleres que estamos celebrando es el taller para #mayores de @Lisarco en el que nos hemos movido e interactuado de manera muy divertida #DíaInternacionalDeLaDanza #Madrid #DíaDeLaDanza #DiaInternacionalDanza https://t.co/Xeqzv2WUeh	#mayores @lisarco #díainternacionaldeladanza #madrid #díadeladanza #diainternacionaldanza otro de el taller que estar celebrar ser el taller para de en el que yo haber mover interactuar de manera mucho divertido
1122446238320922625	864089905328250881	null	2019-04-28 12:23:31	"@aritur215 Pero es que fue flipante entrar y ver a todos los partidos. Todos, con sus carpetas y colores corporativos Y al lado había una militante en silla de ruedas. Seguro si alguien le decía algo iba a ser ""cómo le dices algo a una anciana""..."	@aritur215 pero ser que ser flipante entrar ver todo el partido todo con su carpeta color corporativo al lado haber uno militante en silla de rueda seguro si alguien él decir algo ir ser cómo él decir algo uno anciana
1122446258763980800	2520931809	[-3.7417, 40.38319]	2019-04-28 12:23:36	**Tarta Mousse de Fresas** 🐥Porque estamos en plena temporada de 🍓🍓 y hacemos honores ..también para despedir la Mami de las Mamis... habló de la mia, mis Patycofans... carmen_moreno_coqui  Porque todo tiempo llega… https://t.co/7tIF4ojFcl	tarto moussar de fresa 🐥porque estar en pleno temporada de 🍓🍓 hacer honor también para despedir el mami de el mamis hablar de el mia mi patycofan carmen_moreno_coqui porque todo tiempo llegar
1122446266103992320	2752079265	null	2019-04-28 12:23:38	perreo y todo lo que conlleva perrear 😋😋	perreer todo el que conllevar perrear 😋😋
1122446271002939392	2700385384	null	2019-04-28 12:23:39	Siempre que veo al PSOE abrazado a ETA, me viene a la memoria algunas cosas.	siempre que ver al psoe abrazado eta yo venir el memoria alguno cosa
1122446287792685056	1679286870	null	2019-04-28 12:23:43	a votar se va por la tarde lo saben hasta los chinos	votar se ir por el tarde él saber hasta el chino
1122446290091151366	553048840	null	2019-04-28 12:23:44	Decir que vas a o has votado es tan poser como sacarle fotos a la comida.	decir que vas haber votar ser tanto poser como sacarle foto el comida
1122446290418372608	412462121	null	2019-04-28 12:23:44	@inyustificado Creo que el PP se va a pegar una hostia bastante gorda	@inyustificado creer que el pp él ir pegar uno hostia bastante gordo
1122446297179537409	162118141	null	2019-04-28 12:23:45	Bienvenidos al #28A https://t.co/i8MN3T21yl	#28a bienvenido al
1122446328036855808	58486662	[-3.69377, 40.41056]	2019-04-28 12:23:53	Está pasando!!! La gente se está echando a las calles para votar!!!!! Qué orgullosa estoy!!!! Jamás había visto estás colas 😱. #elecciones2019… https://t.co/RsxYS0wzKQ	#elecciones2019 estar pasar el gente él estar echar el calle para votar qué orgulloso estar jamás haber ver estás cola
1122446434006175746	1099362388032348160	null	2019-04-28 12:24:18	@MuyLiberal @vox_es Solo sabéis dar clases de odio, racismo e intolerancia así que mejor no abras mucho la boca...	@muyliberal @vox_es solo saber dar clase de odio racismo intolerancia así que mejor no abrar mucho el boca
1122446436447268865	718767683802685441	null	2019-04-28 12:24:19	@notNe0 like porque aun sigo bebida	@notne0 likir porque aun seguir bebido
1122446487923888128	387643026	null	2019-04-28 12:24:31	#Votaporfavor no consientas esto.	#votaporfavor no consentar este
1122446512561295361	165158184	null	2019-04-28 12:24:37	@titovelez7 @SheeneMovie Justo estaba pensando en el!	@titovelez7 @sheenemovie justo estar pensar en el
1122446565090701312	429854926	null	2019-04-28 12:24:49	¡Descanso! Termina la primera parte con empate en el marcador.  @cdeamistad 2 - 2 San Ignacio de Loyola  #VamosVerdes https://t.co/6rnqZBvBo1	@cdeamistad #vamosverdes descanso terminar el primero parte con empate en el marcador san ignacio de loyola
1122446590462103552	80613128	null	2019-04-28 12:24:55	@JuliaBarNav El PP sacó más de un 70% en las anteriores así que igual es buena señal	@juliabarnav el pp sacar más de uno 70 en el anterior así que igual ser buen señal
1122446602084466688	147499538	null	2019-04-28 12:24:58	@NievesTuiter @luisabeledo @dieguez_miguel @manu_delorenzo @pgsarria @dariodieguez @JaijoJaijo @Emiliogude @eduardovirgala @LucasBlanque A eso iba 😂😂😂 #LosOfendiditos 🙋🏻‍♂️	@nievestuiter @luisabeledo @dieguez_miguel @manu_delorenzo @pgsarria @dariodieguez @jaijojaijo @emiliogude @eduardovirgala @lucasblanque #losofendiditos ese ir 😂😂😂 🙋🏻‍♂️
1122446616441520129	2303365492	null	2019-04-28 12:25:02	Con los 5 sentidos de paseo por el monte 🌳🌿 y escuchando la naturaleza 💧🐥  🔊 🔊 #Torrelodones https://t.co/Pw0yEYaPHV	#torrelodones con el sentido de paseo por el monte 🌳🌿 escuchar el naturaleza 💧🐥
1122446626587594752	29691642	null	2019-04-28 12:25:04	Aquí va una canción para ti… Salitre de Quique Gonzalez https://t.co/9mSlkYxwUI	aquí ir uno canción para tú salitre de quique gonzalez
1122446646250487810	232931103	null	2019-04-28 12:25:09	#OndaMadrid28A Muchísima gente votando a esta hora. Te lo estamos contando en @ondamadrid, información actualizada cada hora. A las 15h informativo especial y las 19h el análisis con @JPColmenarejo https://t.co/uXG7Al5uTF	#ondamadrid28a @ondamadrid @jpcolmenarejo muchísimo gente votar este hora tú él estar contar en información actualizado cada hora el 15h informativo especial el 19h el análisis con
1122446661224148993	71542755	null	2019-04-28 12:25:12	@RafaCabeleira @gemmaherrero @xabierfortes @MarisolGaldon @08181 @carlestorras @ElPatillas68 Nada impedirá que tengamos SEXO salvaje, querido.	@rafacabeleira @gemmaherrero @xabierfortes @marisolgaldon @08181 @carlestorras @elpatillas68 nada impedir que tengar sexo salvaje querido
1122446687472058368	1473030997	null	2019-04-28 12:25:19	@jolivarestolosa A mí la primera vez no, pero en la segunda me han saltado a la cara todos los gazapos 🙄	@jolivarestolosa yo el primero vez no pero en el segundo yo haber saltar el cara todo el gazapo
1122446711903805440	331828543	null	2019-04-28 12:25:24	@Fatty_Martin Y con el pijama debajo 👌🏼	@fatty_martin con el pijama debajo 👌🏼
1122446757345021952	1020465727508230144	null	2019-04-28 12:25:35	28-04-2019,  La Luna brilla en lo alto.  #Luna #Moon #astronomia #astronomy #astrophotography #Astrofotografía https://t.co/fYtBV5mqBw	#luna #moon #astronomia #astronomy #astrophotography #astrofotografía 28-04-2019 el luna brilla en el alto
1122446759517667330	212030362	null	2019-04-28 12:25:36	Cuánta gente mayor votando a estas horas en mi colegio electoral. Está claro quién está concienciado con estas #EleccionesGenerales28Abril	#eleccionesgenerales28abril cuánto gente mayor votar este hora en mi colegio electoral estar claro quién estar concienciado con este
1122446779767824385	428097313	null	2019-04-28 12:25:41	Plan para la mañana soleada de hoy #28A https://t.co/Z3l2OKLwqL	#28a plan para el mañana soleado de hoy
1122446810394570755	627773461	null	2019-04-28 12:25:48	@JaviTheIceman @elmundodechris Vale, que había leído profesora no se por qué 😅	@javitheiceman @elmundodechris valer que haber leer profesor no él por qué
1122446809715159040	313616553	null	2019-04-28 12:25:48	Hoy he votado en el centro cultural de mi barrio que ha recuperado su nombre y su historia. En nombre de nuestra historia, votemos. Con alegría y empatía pero también con responsabilidad y conciencia. #votaporfavor #votacoño #vota28A https://t.co/2RoHMcXoRR	#votaporfavor #votacoño #vota28a hoy haber votar en el centro cultural de mi barrio que haber recuperar su nombre su historia en nombre de nuestro historia votar con alegría empatía pero también con responsabilidad conciencia
1122446817562640385	3399772227	null	2019-04-28 12:25:50	@hxllands @kortvex Eso educación ante todo	@hxllands @kortvex ese educación ante todo
1122446820624543744	1318379136	null	2019-04-28 12:25:50	Literal que llevo 4 horas y media currando y se me esta haciendo larguísimo	literal que llevar hora m currar él yo este hacer larguísimo
1122446831114424322	778807	null	2019-04-28 12:25:53	Me pregunto qué representa el fantasma con la bandera gay... Ah, sí! QUÉ VAN A POR NOSOTROS!! https://t.co/QldjxFQj6G	yo preguntar qué representar el fantasma con el bandera gay ah sí qué ir por yo
1122446842241925120	711315165	null	2019-04-28 12:25:55	@ClaraAlgara @PCAMPOS321 Clara JAJAJAJ, me estoy mofando muy fuerte.	@claraalgara @pcampos321 claro jajajaj yo estar mofar mucho fuerte
1122446865729978368	71542755	null	2019-04-28 12:26:01	@fabibitan @gemmaherrero @RafaCabeleira @xabierfortes @MarisolGaldon @08181 @carlestorras @andresiniesta8 Vale.  También es el primero que ha felicitado a todos los culés de altededor(es).	@fabibitan @gemmaherrero @rafacabeleira @xabierfortes @marisolgaldon @08181 @carlestorras @andresiniesta8 vale también ser el primero que haber felicitar todo el culés de altededor ser
1122446880112246785	159878684	null	2019-04-28 12:26:04	Voten. Por quien les parezca bien, pero voten. Mucha gente se dejó la vida para que nosotros pudiéramos hacerlo. Buen domingo a todos. https://t.co/0DE4glheUh	votar por quien él parecer bien pero votar mucho gente él dejar el vida para que yo poder hacerlo buen domingo todo
1122446912253300736	8172972	null	2019-04-28 12:26:12	El PNV izquierda progresista.  JAJAJAJAJAJ	el pnv izquierdo progresista jajajajajaj
1122447017588948992	178696681	null	2019-04-28 12:26:37	@LauraLunaLu @Nixarim Encima los hijos de puta utilizan una de mis escenas favoritas en toda la historia del cine, es que me cago en sus vidas	@lauralunalu @nixarim encima el hijo de puta utilizar uno de mi escena favorito en todo el historia del cine ser que yo caer en su vida
1122447025667215360	607277441	null	2019-04-28 12:26:39	Los maricones que votan a vox, pp o C’s, intentemos pensar que es el popper que le está abrasando las neuronas.	el maricón que votar vox pp c’s intenter pensar que ser el popper que él estar abrasar el neurona
1122447032411668482	2835168063	null	2019-04-28 12:26:41	Digamos que en mi familia paterna el voto va a estar dividido entre PP y V🤮X, y hablando con mi madre ha pasado esto: https://t.co/JuWA4OPZ3i	decir que en mi familia paterna el voto ir estar dividido entre pp v🤮x hablar con mi madre haber pasar este
1122447038246019073	153707621	null	2019-04-28 12:26:42	#28A #EleccionesGenerales #VotaConOrgullo #VotaPorFavor #VotaConAmor   (La imagen no sé de quién es 😥) https://t.co/gTgdU1LLOT	#28a #eleccionesgenerales #votaconorgullo #votaporfavor #votaconamor el imagen no saber de quién ser
1122447074019164160	1435286684	null	2019-04-28 12:26:51	Entre el calor que hace, que las muletas me hacen hacer un sobre esfuerzo importante, ha sido llegar y ver a los de vox a la puerta del colegio y me he mareado	entre el calor que hacer que el muleta yo hacer hacer uno sobre esfuerzo importante haber ser llegar ver el de vox el puerta del colegio yo haber marear
1122447076191817728	71542755	null	2019-04-28 12:26:51	@B_LCastro Perdona. Pero quizás lo despidan si hacemos mucho ruido diciendo que @elcorteingles impide votar a sus trabajadores. ¿Apuestas?	@b_lcastro @elcorteingles perdonar pero quizás él despedar si hacer mucho ruido decir que impedir votar su trabajador apuesto
1122447090024689664	7204662	null	2019-04-28 12:26:54	¡Ala!  ¡A votar todo el mundo! #VotaPorFavor #28A	#votaporfavor #28a alar votar todo el mundo
1122447100405587969	759168409833734144	null	2019-04-28 12:26:57	@VilarLeticia Muchas gracias Leticia!!! 😍	@vilarleticia mucho gracia leticia
1122447104339849217	1006079186	null	2019-04-28 12:26:58	Un fichaje así es lo que España merece... @sanchezcastejon @pablocasado_ @Pablo_Iglesias_ @Albert_Rivera #Endesa #EleccionesGenerales https://t.co/LJCDRnAvoa	@sanchezcastejon @pablocasado @pablo_iglesias @albert_rivera #endesa #eleccionesgenerales uno fichaje así ser el que españa merecer
1122447103660318720	3017233264	null	2019-04-28 12:26:58	Da gusto ver tanta gente viniendo a votar, a decidir por el futuro de España #Elecciones28A #ApoderadosCs https://t.co/71o2d5dUQU	#elecciones28a #apoderadoscs dar gusto ver tanto gente vinir votar decidir por el futuro de españa
1122447115693776898	1442010354	null	2019-04-28 12:27:01	Que vergonzoso esto.	que vergonzosar este
1122447116662652928	44657511	null	2019-04-28 12:27:01	@Cocco01339869 Así dice la nota. Me alegra por los empleados.	@cocco01339869 así decir el nota yo alegrar por el empleado
1122447127077167106	3833851425	null	2019-04-28 12:27:03	Acabo de sacar tema nuevo. Quiero un Ferrari como Travis Checkealo 🚀💥  https://t.co/dgmRsXCprs	acabar de sacar tema nuevo querer uno ferrari como travis checkealo 🚀💥
1122447149994782720	2828853396	null	2019-04-28 12:27:09	@Bill4game Y aquí. No se si eso es bueno o malo xdddd	@bill4game aquí no se si ese ser buen malo xdddd
1122447169494102016	1470611136	null	2019-04-28 12:27:13	Acordémonos, porfa, en esta jornada de elecciones también de lxs miles de periodistas que hoy trabajan para ofrecernos toda la información en tiempo real y con la mayor veracidad posible, en un momento donde la libertad de prensa se ve amenazada por la extrema derecha. #28A	#28a acordémono porfar en este jornada de elección también de lxs miles de periodista que hoy trabajar para ofrecernose todo el información en tiempo real con el mayor veracidad posible en uno momento donde el libertad de prensa él ver amenazado por el extremo derecha
1122447178016931841	362506229	null	2019-04-28 12:27:15	Vengadores: Endgame (2019) Nota: 9/10. https://t.co/lDGkaY40KG	vengador endgamar 2019 nota 9/10
1122447195326812160	314730826	null	2019-04-28 12:27:20	Creo que voy a ir a poner una velita a la Virgen del Val pa que la proteja	creer que ir ir poner uno velita el virgen del val pa que el proteja
1122447200313925632	580745896	null	2019-04-28 12:27:21	@canfirot Yo ya he votado, espero que podamos conseguir un cambio	@canfirot yo ya haber votar esperar que poder conseguir uno cambio
1122447206110433283	1531589856	null	2019-04-28 12:27:22	@Mistercandado Me refiero a que te tiene que llegar tu momento de hacerlo, igual que te llegó a ti y me llegó a mí	@mistercandado yo referir que tú tener que llegar tu momento de hacerlo igual que tú llegar ti yo llegar yo
1122447260871213056	99136626	null	2019-04-28 12:27:35	@JotDownSpain Porque como él dice cuando le preguntan a qué se dedica: I change the story #RayDonovan https://t.co/bV3PKpxVcW	@jotdownspain #raydonovan porque como él decir cuando él preguntar qué se dedicar change the story
1122447282958422017	601803849	null	2019-04-28 12:27:40	@realitystas Ambos me gustan, Emilio es mi favorito junto a nuestro presidente de esta nuestra comunidad Juan Cuesta, pero Fermín tiene esa absurded y chuleria, basicamente es Emilio si nunca hubiera dejado el chiringuito con Belen, o años mas tarde de separse de Paquito al final.	@realitystas ambos yo gustar emilio ser mi favorito junto nuestro presidente de este nuestro comunidad juan costar pero fermín tener ese absurded chuleria basicamente ser emilio si nunca haber dejar el chiringuito con belen año mas tarde de separse de paquito al final
1122447303586058241	302179893	null	2019-04-28 12:27:45	A mi nadie me dice cobarde @pablocasado_ @ppmadrid @NNGG_Es #28A https://t.co/pFK7FKYj85	@pablocasado @ppmadrid @nngg_es #28a mi nadie yo decir cobarde
1122447359819034624	953550527597547520	null	2019-04-28 12:27:59	Nunca es triste la verdad,  lo que no tiene es remedio	nunca ser triste el verdad el que no tener ser remedio
1122447418568708097	405002420	null	2019-04-28 12:28:13	Me acabo de despertar y vaya resaquita. Voy a ir a votar arrastrandome	yo acabar de despertar ir resaquito ir ir votar a
