detected	from
Yo ya he votado. #28A #EleccionesGenerales #VotaPorFavor	Ya he votado!!!!
Ale pues ya he votado #28A #EleccionesGenerales28A	Ya he votado!!!!
Te amo tres millones 游눖	te amo
Llevamos a침os las mujeres luchando por nuestros derechos para que ahora vengan 4 gilipollas y nos quiten todo lo que hemos conseguido ? #votarconcabeza	Llevamos a침os las mujeres luchando por nuestros derechos y ahora van a ser 4 gilipollas los que nos lo la quiten ? #votarconcabeza
Ya he votado, ahora a esperar	Ya he votado!!!!
Vale, pero porque ya he votado	Ya he votado!!!!
"#EleccionesGenerales28A ""YA HE VOTADO"" Unidas Podemos"	Ya he votado!!!!
#RETENCI칍N nivel AMARILLO en AUTOPISTA / AUTOV칈A #A6 (pk 16 al 18 decreciente) POZUELO DE ALARCON #DGTMadrid #DGT	#RETENCI칍N nivel AMARILLO en AUTOPISTA / AUTOV칈A #A6 (pk 12.5 al 17 decreciente) POZUELO DE ALARCON #DGTMadrid #DGT
P30 Pro. No edits.	P30 Pro. No edits.
Eso est치 claro Isa, pero es el centro electoral el que debe garantizar el derecho constitucional.	No es as칤 Bea, es el centro electoral el que debe garantizar el voto secreto, no el ciudadano. Hablamos de un derecho constitucional reconocido en el art칤culo 14 de la CE, por lo tanto fundamental, para los que se debe dotar de m치xima protecci칩n.
Acaba de publicar una foto en Campo del Moro	Acaba de publicar una foto en Palacio Real de Madrid, Espa침a
Hablo en todo momento de porcentaje de voto, no de esca침os. Faltar칤a por a침adir a independentistas y nacionalistas. Las derechas obtendr칤an el 48,6%.	Hablo en todo momento de porcentaje de voto, no de esca침os. Faltar칤a por a침adir a independentistas y nacionalistas.
Ya he votado #ValorSeguro Ya he votado por #28A	Ya he votado!!!!
Acaba de publicar una foto en Campo del Moro	Acaba de publicar una foto en Palacio Real de Madrid, Espa침a
Que* por favor y gracias	춰Gracias!
Buenos d칤as twitter! No os quiere nadie.	Buenos d칤as
Listo, ya he votado	Ya he votado!!!!
游눞游눙游녪游녪游녪游녪 recordemos	Recordemos #28A
Es el centro electoral el que tiene que garantizar el voto secreto, no el ciudadano.	No es as칤 Bea, es el centro electoral el que debe garantizar el voto secreto, no el ciudadano. Hablamos de un derecho constitucional reconocido en el art칤culo 14 de la CE, por lo tanto fundamental, para los que se debe dotar de m치xima protecci칩n.
춰Por Espa침a! Por la Espa침a de por la de los derechos #LGTBI+, por la sanidad p칰blica de calidad, por leyes que protejan de la violencia machista, por la Espa침a con memoria hist칩rica, por la que sale a las calles el #8M... #EleccionesGenerales28A #28A #VotaPorFavor	POR ESPA칌A 游눩游낕游쀯릖 #28A
A llorar jajajaja	O llorar xD
Ya he votado. 춰Qu칠 satisfacci칩n! #28A	Ya he votado!!!!
Acaba de publicar una foto en Campo del Moro	Acaba de publicar una foto en Palacio Real de Madrid, Espa침a
Los amores incompatibles no son imposibles, se pueden hacer incluso m치s fuertes porque para que funcionen necesitan de mayor inter칠s, esfuerzo y comprensi칩n.	Los amores incompatibles no son imposibles, se pueden hacer incluso m치s fuertes porque para que funcionen necesitan de mayor inter칠s, esfuerzo y compresi칩n.
#RETENCI칍N nivel AMARILLO en AUTOPISTA / AUTOV칈A #A6 (pk 16 al 19 decreciente) POZUELO DE ALARCON #DGTMadrid #DGT	#RETENCI칍N nivel AMARILLO en AUTOPISTA / AUTOV칈A #A6 (pk 12.5 al 17 decreciente) POZUELO DE ALARCON #DGTMadrid #DGT
